nohup: girdi yok sayılıyor
[yargitay] listing since 2005-01-01 (live=True, resume=False)
[RUN ed869681-69c7-486e-929a-628f696716f3] Enqueued 820 refs for yargitay:2005-01-01->2009-12-31
2025-11-20 01:15:01 [warning  ] yargitay_detail_error          attempt=1 error=Page.wait_for_selector: Timeout 30000ms exceeded.
Call log:
  - waiting for locator("table tbody tr") to be visible
 key=YARGITAY:12.HD:2209/12347-2009/20860:28.10.2009
ref: key='YARGITAY:12.HD:2209/12347-2009/20860:28.10.2009' url=AnyHttpUrl('https://karararama.yargitay.gov.tr/') etag=None last_modified=None metadata={'chamber': '12.HD', 'e_no': '2209/12347', 'k_no': '2009/20860', 'decision_date': '28.10.2009', 'doc_id': '61850300'}
doc_id=yargitay:12.HD:2209/12347-2009/20860:2009-10-28 title='Karar' chunks=1 checksum=104c903201...
  chunk[0] tokens=236 preview='[KAYNAK:Yargıtay|DAİRE:12.HD|E:2209/12347|K:2009/20860|T:2009-10-28] [METİN] 12.'
----------------------------------------
ref: key='YARGITAY:12.HD:2209/11589-2009/19935:22.10.2009' url=AnyHttpUrl('https://karararama.yargitay.gov.tr/') etag=None last_modified=None metadata={'chamber': '12.HD', 'e_no': '2209/11589', 'k_no': '2009/19935', 'decision_date': '22.10.2009', 'doc_id': '60442500'}
doc_id=yargitay:12.HD:2209/11589-2009/19935:2009-10-22 title='Karar' chunks=1 checksum=b4809ac114...
  chunk[0] tokens=103 preview='[KAYNAK:Yargıtay|DAİRE:12.HD|E:2209/11589|K:2009/19935|T:2009-10-22] [METİN] 12.'
----------------------------------------
ref: key='YARGITAY:12.HD:2013/19425-2013/19875:22.10.2009' url=AnyHttpUrl('https://karararama.yargitay.gov.tr/') etag=None last_modified=None metadata={'chamber': '12.HD', 'e_no': '2013/19425', 'k_no': '2013/19875', 'decision_date': '22.10.2009', 'doc_id': '60365600'}
doc_id=yargitay:12.HD:2013/19425-2013/19875:2009-10-22 title='Karar' chunks=1 checksum=e092afbce4...
  chunk[0] tokens=97 preview='[KAYNAK:Yargıtay|DAİRE:12.HD|E:2013/19425|K:2013/19875|T:2009-10-22] [METİN] 12.'
----------------------------------------
ref: key='YARGITAY:GK:2013/29-2013/1072:08.03.2007' url=AnyHttpUrl('https://karararama.yargitay.gov.tr/') etag=None last_modified=None metadata={'chamber': 'GK', 'e_no': '2013/29', 'k_no': '2013/1072', 'decision_date': '08.03.2007', 'doc_id': '76499000'}
doc_id=yargitay:GK:2013/29-2013/1072:2007-03-08 title='Karar' chunks=1 checksum=7ae6ada6e5...
  chunk[0] tokens=1278 preview='[KAYNAK:Yargıtay|DAİRE:GK|E:2013/29|K:2013/1072|T:2007-03-08] [METİN] Hukuk Gene'
----------------------------------------
ref: key='YARGITAY:2.HD:2012/5868-2012/25633:22.10.2006' url=AnyHttpUrl('https://karararama.yargitay.gov.tr/') etag=None last_modified=None metadata={'chamber': '2.HD', 'e_no': '2012/5868', 'k_no': '2012/25633', 'decision_date': '22.10.2006', 'doc_id': '45508300'}
doc_id=yargitay:2.HD:2012/5868-2012/25633:2006-10-22 title='Karar' chunks=1 checksum=5fafb5c79a...
  chunk[0] tokens=494 preview='[KAYNAK:Yargıtay|DAİRE:2.HD|E:2012/5868|K:2012/25633|T:2006-10-22] [METİN] 2. Hu'
----------------------------------------
ref: key='YARGITAY:6.HD:2012/1755-2012/4804:26.03.2009' url=AnyHttpUrl('https://karararama.yargitay.gov.tr/') etag=None last_modified=None metadata={'chamber': '6.HD', 'e_no': '2012/1755', 'k_no': '2012/4804', 'decision_date': '26.03.2009', 'doc_id': '17245000'}
doc_id=yargitay:6.HD:2012/1755-2012/4804:2009-03-26 title='Karar' chunks=1 checksum=c960de1b04...
  chunk[0] tokens=334 preview='[KAYNAK:Yargıtay|DAİRE:6.HD|E:2012/1755|K:2012/4804|T:2009-03-26] [METİN] "İçtih'
----------------------------------------
ref: key='YARGITAY:2.HD:2011/10789-2011/11466:05.07.2007' url=AnyHttpUrl('https://karararama.yargitay.gov.tr/') etag=None last_modified=None metadata={'chamber': '2.HD', 'e_no': '2011/10789', 'k_no': '2011/11466', 'decision_date': '05.07.2007', 'doc_id': '81264500'}
doc_id=yargitay:2.HD:2011/10789-2011/11466:2007-07-05 title='Karar' chunks=1 checksum=55054877a5...
  chunk[0] tokens=245 preview='[KAYNAK:Yargıtay|DAİRE:2.HD|E:2011/10789|K:2011/11466|T:2007-07-05] [METİN] 2. H'
----------------------------------------
ref: key='YARGITAY:12.HD:2011/7625-2011/24842:28.11.2007' url=AnyHttpUrl('https://karararama.yargitay.gov.tr/') etag=None last_modified=None metadata={'chamber': '12.HD', 'e_no': '2011/7625', 'k_no': '2011/24842', 'decision_date': '28.11.2007', 'doc_id': '66061100'}
doc_id=yargitay:12.HD:2011/7625-2011/24842:2007-11-28 title='Karar' chunks=1 checksum=9067105771...
  chunk[0] tokens=102 preview='[KAYNAK:Yargıtay|DAİRE:12.HD|E:2011/7625|K:2011/24842|T:2007-11-28] [METİN] 12. '
----------------------------------------
ref: key='YARGITAY:1.HD:2011/6486-2011/7410:23.06.2008' url=AnyHttpUrl('https://karararama.yargitay.gov.tr/') etag=None last_modified=None metadata={'chamber': '1.HD', 'e_no': '2011/6486', 'k_no': '2011/7410', 'decision_date': '23.06.2008', 'doc_id': '78847500'}
doc_id=yargitay:1.HD:2011/6486-2011/7410:2008-06-23 title='Karar' chunks=1 checksum=0d2d9cde29...
  chunk[0] tokens=483 preview='[KAYNAK:Yargıtay|DAİRE:1.HD|E:2011/6486|K:2011/7410|T:2008-06-23] [METİN] 1. Huk'
----------------------------------------
ref: key='YARGITAY:1.HD:2011/6378-2011/7417:23.06.2008' url=AnyHttpUrl('https://karararama.yargitay.gov.tr/') etag=None last_modified=None metadata={'chamber': '1.HD', 'e_no': '2011/6378', 'k_no': '2011/7417', 'decision_date': '23.06.2008', 'doc_id': '78847000'}
doc_id=yargitay:1.HD:2011/6378-2011/7417:2008-06-23 title='Karar' chunks=1 checksum=a8efe92ac5...
  chunk[0] tokens=733 preview='[KAYNAK:Yargıtay|DAİRE:1.HD|E:2011/6378|K:2011/7417|T:2008-06-23] [METİN] 1. Huk'
----------------------------------------
ref: key='YARGITAY:1.HD:2011/5906-2011/6621:02.06.2008' url=AnyHttpUrl('https://karararama.yargitay.gov.tr/') etag=None last_modified=None metadata={'chamber': '1.HD', 'e_no': '2011/5906', 'k_no': '2011/6621', 'decision_date': '02.06.2008', 'doc_id': '78699500'}
doc_id=yargitay:1.HD:2011/5906-2011/6621:2008-06-02 title='Karar' chunks=1 checksum=b3b0d33400...
  chunk[0] tokens=571 preview='[KAYNAK:Yargıtay|DAİRE:1.HD|E:2011/5906|K:2011/6621|T:2008-06-02] [METİN] 1. Huk'
----------------------------------------
ref: key='YARGITAY:1.HD:2011/5491-2011/7412:23.06.2008' url=AnyHttpUrl('https://karararama.yargitay.gov.tr/') etag=None last_modified=None metadata={'chamber': '1.HD', 'e_no': '2011/5491', 'k_no': '2011/7412', 'decision_date': '23.06.2008', 'doc_id': '78847300'}
doc_id=yargitay:1.HD:2011/5491-2011/7412:2008-06-23 title='Karar' chunks=1 checksum=b2dcec44f9...
  chunk[0] tokens=547 preview='[KAYNAK:Yargıtay|DAİRE:1.HD|E:2011/5491|K:2011/7412|T:2008-06-23] [METİN] 1. Huk'
----------------------------------------
ref: key='YARGITAY:1.HD:2011/5468-2011/6618:02.06.2008' url=AnyHttpUrl('https://karararama.yargitay.gov.tr/') etag=None last_modified=None metadata={'chamber': '1.HD', 'e_no': '2011/5468', 'k_no': '2011/6618', 'decision_date': '02.06.2008', 'doc_id': '78697400'}
doc_id=yargitay:1.HD:2011/5468-2011/6618:2008-06-02 title='Karar' chunks=1 checksum=ee2cb2ed9b...
  chunk[0] tokens=625 preview='[KAYNAK:Yargıtay|DAİRE:1.HD|E:2011/5468|K:2011/6618|T:2008-06-02] [METİN] 1. Huk'
----------------------------------------
ref: key='YARGITAY:20.HD:2011/5205-2011/9685:18.12.2008' url=AnyHttpUrl('https://karararama.yargitay.gov.tr/') etag=None last_modified=None metadata={'chamber': '20.HD', 'e_no': '2011/5205', 'k_no': '2011/9685', 'decision_date': '18.12.2008', 'doc_id': '17194800'}
doc_id=yargitay:20.HD:2011/5205-2011/9685:2008-12-18 title='Karar' chunks=1 checksum=87af5be240...
  chunk[0] tokens=890 preview='[KAYNAK:Yargıtay|DAİRE:20.HD|E:2011/5205|K:2011/9685|T:2008-12-18] [METİN] "İçti'
----------------------------------------
ref: key='YARGITAY:22.HD:2011/2700-2011/273:27.07.2007' url=AnyHttpUrl('https://karararama.yargitay.gov.tr/') etag=None last_modified=None metadata={'chamber': '22.HD', 'e_no': '2011/2700', 'k_no': '2011/273', 'decision_date': '27.07.2007', 'doc_id': '77666700'}
doc_id=yargitay:22.HD:2011/2700-2011/273:2007-07-27 title='Karar' chunks=1 checksum=397bce0bfa...
  chunk[0] tokens=645 preview='[KAYNAK:Yargıtay|DAİRE:22.HD|E:2011/2700|K:2011/273|T:2007-07-27] [METİN] 22. Hu'
----------------------------------------
ref: key='YARGITAY:12.HD:2011/2353-2011/17253:09.01.2009' url=AnyHttpUrl('https://karararama.yargitay.gov.tr/') etag=None last_modified=None metadata={'chamber': '12.HD', 'e_no': '2011/2353', 'k_no': '2011/17253', 'decision_date': '09.01.2009', 'doc_id': '61085600'}
doc_id=yargitay:12.HD:2011/2353-2011/17253:2009-01-09 title='Karar' chunks=1 checksum=15ebd7eb03...
  chunk[0] tokens=81 preview='[KAYNAK:Yargıtay|DAİRE:12.HD|E:2011/2353|K:2011/17253|T:2009-01-09] [METİN] 12. '
----------------------------------------
ref: key='YARGITAY:GK:2011/868-2012/98:13.07.2005' url=AnyHttpUrl('https://karararama.yargitay.gov.tr/') etag=None last_modified=None metadata={'chamber': 'GK', 'e_no': '2011/868', 'k_no': '2012/98', 'decision_date': '13.07.2005', 'doc_id': '77129700'}
doc_id=yargitay:GK:2011/868-2012/98:2005-07-13 title='Karar' chunks=1 checksum=340804052c...
  chunk[0] tokens=667 preview='[KAYNAK:Yargıtay|DAİRE:GK|E:2011/868|K:2012/98|T:2005-07-13] [METİN] Ceza Genel '
----------------------------------------
ref: key='YARGITAY:GK:2011/818-2012/49:17.07.2009' url=AnyHttpUrl('https://karararama.yargitay.gov.tr/') etag=None last_modified=None metadata={'chamber': 'GK', 'e_no': '2011/818', 'k_no': '2012/49', 'decision_date': '17.07.2009', 'doc_id': '77073900'}
doc_id=yargitay:GK:2011/818-2012/49:2009-07-17 title='Karar' chunks=1 checksum=99343aadf7...
  chunk[0] tokens=1292 preview='[KAYNAK:Yargıtay|DAİRE:GK|E:2011/818|K:2012/49|T:2009-07-17] [METİN] Hukuk Genel'
----------------------------------------
ref: key='YARGITAY:GK:2011/621-2012/45:21.12.2005' url=AnyHttpUrl('https://karararama.yargitay.gov.tr/') etag=None last_modified=None metadata={'chamber': 'GK', 'e_no': '2011/621', 'k_no': '2012/45', 'decision_date': '21.12.2005', 'doc_id': '77119400'}
doc_id=yargitay:GK:2011/621-2012/45:2005-12-21 title='Karar' chunks=1 checksum=678439a14a...
  chunk[0] tokens=4428 preview='[KAYNAK:Yargıtay|DAİRE:GK|E:2011/621|K:2012/45|T:2005-12-21] [METİN] Ceza Genel '
----------------------------------------
ref: key='YARGITAY:GK:2011/564-2012/35:14.12.2005' url=AnyHttpUrl('https://karararama.yargitay.gov.tr/') etag=None last_modified=None metadata={'chamber': 'GK', 'e_no': '2011/564', 'k_no': '2012/35', 'decision_date': '14.12.2005', 'doc_id': '77118100'}
doc_id=yargitay:GK:2011/564-2012/35:2005-12-14 title='Karar' chunks=1 checksum=efac7e74e5...
  chunk[0] tokens=654 preview='[KAYNAK:Yargıtay|DAİRE:GK|E:2011/564|K:2012/35|T:2005-12-14] [METİN] Ceza Genel '
----------------------------------------
ref: key='YARGITAY:GK:2011/511-2012/46:21.12.2005' url=AnyHttpUrl('https://karararama.yargitay.gov.tr/') etag=None last_modified=None metadata={'chamber': 'GK', 'e_no': '2011/511', 'k_no': '2012/46', 'decision_date': '21.12.2005', 'doc_id': '77119800'}
doc_id=yargitay:GK:2011/511-2012/46:2005-12-21 title='Karar' chunks=1 checksum=194579634a...
  chunk[0] tokens=4512 preview='[KAYNAK:Yargıtay|DAİRE:GK|E:2011/511|K:2012/46|T:2005-12-21] [METİN] Ceza Genel '
----------------------------------------
ref: key='YARGITAY:GK:2011/506-2012/47:21.12.2005' url=AnyHttpUrl('https://karararama.yargitay.gov.tr/') etag=None last_modified=None metadata={'chamber': 'GK', 'e_no': '2011/506', 'k_no': '2012/47', 'decision_date': '21.12.2005', 'doc_id': '77118600'}
doc_id=yargitay:GK:2011/506-2012/47:2005-12-21 title='Karar' chunks=1 checksum=c75e2cb7cc...
  chunk[0] tokens=4407 preview='[KAYNAK:Yargıtay|DAİRE:GK|E:2011/506|K:2012/47|T:2005-12-21] [METİN] Ceza Genel '
----------------------------------------
ref: key='YARGITAY:GK:2011/492-2012/87:13.07.2005' url=AnyHttpUrl('https://karararama.yargitay.gov.tr/') etag=None last_modified=None metadata={'chamber': 'GK', 'e_no': '2011/492', 'k_no': '2012/87', 'decision_date': '13.07.2005', 'doc_id': '77125900'}
doc_id=yargitay:GK:2011/492-2012/87:2005-07-13 title='Karar' chunks=1 checksum=5d6d562cb7...
  chunk[0] tokens=2179 preview='[KAYNAK:Yargıtay|DAİRE:GK|E:2011/492|K:2012/87|T:2005-07-13] [METİN] Ceza Genel '
----------------------------------------
ref: key='YARGITAY:GK:2011/486--:21.12.2005' url=AnyHttpUrl('https://karararama.yargitay.gov.tr/') etag=None last_modified=None metadata={'chamber': 'GK', 'e_no': '2011/486', 'k_no': '-', 'decision_date': '21.12.2005', 'doc_id': '77120500'}
doc_id=yargitay:GK:2011/486--:2005-12-21 title='Karar' chunks=1 checksum=93a5640071...
  chunk[0] tokens=1823 preview='[KAYNAK:Yargıtay|DAİRE:GK|E:2011/486|K:-|T:2005-12-21] [METİN] Ceza Genel Kurulu'
----------------------------------------
ref: key='YARGITAY:GK:2011/358-2012/48:21.12.2005' url=AnyHttpUrl('https://karararama.yargitay.gov.tr/') etag=None last_modified=None metadata={'chamber': 'GK', 'e_no': '2011/358', 'k_no': '2012/48', 'decision_date': '21.12.2005', 'doc_id': '77119000'}
doc_id=yargitay:GK:2011/358-2012/48:2005-12-21 title='Karar' chunks=1 checksum=4417e50c0c...
  chunk[0] tokens=776 preview='[KAYNAK:Yargıtay|DAİRE:GK|E:2011/358|K:2012/48|T:2005-12-21] [METİN] Ceza Genel '
----------------------------------------
ref: key='YARGITAY:GK:2011/236-2012/86:13.07.2005' url=AnyHttpUrl('https://karararama.yargitay.gov.tr/') etag=None last_modified=None metadata={'chamber': 'GK', 'e_no': '2011/236', 'k_no': '2012/86', 'decision_date': '13.07.2005', 'doc_id': '77126600'}
doc_id=yargitay:GK:2011/236-2012/86:2005-07-13 title='Karar' chunks=1 checksum=731a0bfeb3...
  chunk[0] tokens=5454 preview='[KAYNAK:Yargıtay|DAİRE:GK|E:2011/236|K:2012/86|T:2005-07-13] [METİN] Ceza Genel '
----------------------------------------
ref: key='YARGITAY:2.HD:2010/23431-2011/7707:05.05.2009' url=AnyHttpUrl('https://karararama.yargitay.gov.tr/') etag=None last_modified=None metadata={'chamber': '2.HD', 'e_no': '2010/23431', 'k_no': '2011/7707', 'decision_date': '05.05.2009', 'doc_id': '81236800'}
doc_id=yargitay:2.HD:2010/23431-2011/7707:2009-05-05 title='Karar' chunks=1 checksum=e24d662f28...
  chunk[0] tokens=120 preview='[KAYNAK:Yargıtay|DAİRE:2.HD|E:2010/23431|K:2011/7707|T:2009-05-05] [METİN] 2. Hu'
----------------------------------------
ref: key='YARGITAY:2.HD:2010/18092-2011/7679:05.05.2009' url=AnyHttpUrl('https://karararama.yargitay.gov.tr/') etag=None last_modified=None metadata={'chamber': '2.HD', 'e_no': '2010/18092', 'k_no': '2011/7679', 'decision_date': '05.05.2009', 'doc_id': '81232100'}
doc_id=yargitay:2.HD:2010/18092-2011/7679:2009-05-05 title='Karar' chunks=1 checksum=ee8b8d2cdc...
  chunk[0] tokens=259 preview='[KAYNAK:Yargıtay|DAİRE:2.HD|E:2010/18092|K:2011/7679|T:2009-05-05] [METİN] 2. Hu'
----------------------------------------
ref: key='YARGITAY:2.HD:2010/18089-2011/7708:05.05.2009' url=AnyHttpUrl('https://karararama.yargitay.gov.tr/') etag=None last_modified=None metadata={'chamber': '2.HD', 'e_no': '2010/18089', 'k_no': '2011/7708', 'decision_date': '05.05.2009', 'doc_id': '81241500'}
doc_id=yargitay:2.HD:2010/18089-2011/7708:2009-05-05 title='Karar' chunks=1 checksum=c71e7b59ed...
  chunk[0] tokens=199 preview='[KAYNAK:Yargıtay|DAİRE:2.HD|E:2010/18089|K:2011/7708|T:2009-05-05] [METİN] 2. Hu'
----------------------------------------
ref: key='YARGITAY:12.HD:2010/10885-2010/23647:18.10.2009' url=AnyHttpUrl('https://karararama.yargitay.gov.tr/') etag=None last_modified=None metadata={'chamber': '12.HD', 'e_no': '2010/10885', 'k_no': '2010/23647', 'decision_date': '18.10.2009', 'doc_id': '59774700'}
doc_id=yargitay:12.HD:2010/10885-2010/23647:2009-10-18 title='Karar' chunks=1 checksum=95ae54c591...
  chunk[0] tokens=255 preview='[KAYNAK:Yargıtay|DAİRE:12.HD|E:2010/10885|K:2010/23647|T:2009-10-18] [METİN] 12.'
----------------------------------------
ref: key='YARGITAY:12.HD:2010/10575-2010/23177:02.06.2009' url=AnyHttpUrl('https://karararama.yargitay.gov.tr/') etag=None last_modified=None metadata={'chamber': '12.HD', 'e_no': '2010/10575', 'k_no': '2010/23177', 'decision_date': '02.06.2009', 'doc_id': '59075400'}
doc_id=yargitay:12.HD:2010/10575-2010/23177:2009-06-02 title='Karar' chunks=1 checksum=ca32a7ee5a...
  chunk[0] tokens=153 preview='[KAYNAK:Yargıtay|DAİRE:12.HD|E:2010/10575|K:2010/23177|T:2009-06-02] [METİN] 12.'
----------------------------------------
ref: key='YARGITAY:2.HD:2010/6519-2011/7695:05.05.2009' url=AnyHttpUrl('https://karararama.yargitay.gov.tr/') etag=None last_modified=None metadata={'chamber': '2.HD', 'e_no': '2010/6519', 'k_no': '2011/7695', 'decision_date': '05.05.2009', 'doc_id': '81224900'}
doc_id=yargitay:2.HD:2010/6519-2011/7695:2009-05-05 title='Karar' chunks=1 checksum=262c9c8604...
  chunk[0] tokens=317 preview='[KAYNAK:Yargıtay|DAİRE:2.HD|E:2010/6519|K:2011/7695|T:2009-05-05] [METİN] 2. Huk'
----------------------------------------
ref: key='YARGITAY:2.HD:2010/6495-2011/7691:05.05.2009' url=AnyHttpUrl('https://karararama.yargitay.gov.tr/') etag=None last_modified=None metadata={'chamber': '2.HD', 'e_no': '2010/6495', 'k_no': '2011/7691', 'decision_date': '05.05.2009', 'doc_id': '81233400'}
doc_id=yargitay:2.HD:2010/6495-2011/7691:2009-05-05 title='Karar' chunks=1 checksum=5fbb63c4aa...
  chunk[0] tokens=185 preview='[KAYNAK:Yargıtay|DAİRE:2.HD|E:2010/6495|K:2011/7691|T:2009-05-05] [METİN] 2. Huk'
----------------------------------------
ref: key='YARGITAY:2.HD:2010/6494-2011/7690:05.05.2009' url=AnyHttpUrl('https://karararama.yargitay.gov.tr/') etag=None last_modified=None metadata={'chamber': '2.HD', 'e_no': '2010/6494', 'k_no': '2011/7690', 'decision_date': '05.05.2009', 'doc_id': '81238400'}
doc_id=yargitay:2.HD:2010/6494-2011/7690:2009-05-05 title='Karar' chunks=1 checksum=336de4b526...
  chunk[0] tokens=177 preview='[KAYNAK:Yargıtay|DAİRE:2.HD|E:2010/6494|K:2011/7690|T:2009-05-05] [METİN] 2. Huk'
----------------------------------------
ref: key='YARGITAY:2.HD:2010/6492-2011/7688:05.05.2009' url=AnyHttpUrl('https://karararama.yargitay.gov.tr/') etag=None last_modified=None metadata={'chamber': '2.HD', 'e_no': '2010/6492', 'k_no': '2011/7688', 'decision_date': '05.05.2009', 'doc_id': '81226700'}
doc_id=yargitay:2.HD:2010/6492-2011/7688:2009-05-05 title='Karar' chunks=1 checksum=fcf50e29bf...
  chunk[0] tokens=102 preview='[KAYNAK:Yargıtay|DAİRE:2.HD|E:2010/6492|K:2011/7688|T:2009-05-05] [METİN] 2. Huk'
----------------------------------------
ref: key='YARGITAY:2.HD:2010/5923-2010/6405:05.04.2008' url=AnyHttpUrl('https://karararama.yargitay.gov.tr/') etag=None last_modified=None metadata={'chamber': '2.HD', 'e_no': '2010/5923', 'k_no': '2010/6405', 'decision_date': '05.04.2008', 'doc_id': '81564800'}
doc_id=yargitay:2.HD:2010/5923-2010/6405:2008-04-05 title='Karar' chunks=1 checksum=aaffe358b4...
  chunk[0] tokens=90 preview='[KAYNAK:Yargıtay|DAİRE:2.HD|E:2010/5923|K:2010/6405|T:2008-04-05] [METİN] 2. Huk'
----------------------------------------
ref: key='YARGITAY:2.HD:2010/4332-2011/7747:05.05.2009' url=AnyHttpUrl('https://karararama.yargitay.gov.tr/') etag=None last_modified=None metadata={'chamber': '2.HD', 'e_no': '2010/4332', 'k_no': '2011/7747', 'decision_date': '05.05.2009', 'doc_id': '81240600'}
doc_id=yargitay:2.HD:2010/4332-2011/7747:2009-05-05 title='Karar' chunks=1 checksum=78769b4b93...
  chunk[0] tokens=230 preview='[KAYNAK:Yargıtay|DAİRE:2.HD|E:2010/4332|K:2011/7747|T:2009-05-05] [METİN] 2. Huk'
----------------------------------------
ref: key='YARGITAY:GK:2010/621-2010/483:13.10.2006' url=AnyHttpUrl('https://karararama.yargitay.gov.tr/') etag=None last_modified=None metadata={'chamber': 'GK', 'e_no': '2010/621', 'k_no': '2010/483', 'decision_date': '13.10.2006', 'doc_id': '76935800'}
doc_id=yargitay:GK:2010/621-2010/483:2006-10-13 title='Karar' chunks=1 checksum=f446a3f3d9...
  chunk[0] tokens=651 preview='[KAYNAK:Yargıtay|DAİRE:GK|E:2010/621|K:2010/483|T:2006-10-13] [METİN] Hukuk Gene'
----------------------------------------
ref: key='YARGITAY:GK:2010/510-2010/485:13.10.2006' url=AnyHttpUrl('https://karararama.yargitay.gov.tr/') etag=None last_modified=None metadata={'chamber': 'GK', 'e_no': '2010/510', 'k_no': '2010/485', 'decision_date': '13.10.2006', 'doc_id': '76934900'}
doc_id=yargitay:GK:2010/510-2010/485:2006-10-13 title='Karar' chunks=1 checksum=e8f4650353...
  chunk[0] tokens=1669 preview='[KAYNAK:Yargıtay|DAİRE:GK|E:2010/510|K:2010/485|T:2006-10-13] [METİN] Hukuk Gene'
----------------------------------------
ref: key='YARGITAY:9.HD:2009/43199-2009/31627:13.11.2009' url=AnyHttpUrl('https://karararama.yargitay.gov.tr/') etag=None last_modified=None metadata={'chamber': '9.HD', 'e_no': '2009/43199', 'k_no': '2009/31627', 'decision_date': '13.11.2009', 'doc_id': '870908600'}
doc_id=yargitay:9.HD:2009/43199-2009/31627:2009-11-13 title='Karar' chunks=1 checksum=caa783ff9d...
  chunk[0] tokens=74 preview='[KAYNAK:Yargıtay|DAİRE:9.HD|E:2009/43199|K:2009/31627|T:2009-11-13] [METİN] 9. H'
----------------------------------------
ref: key='YARGITAY:9.HD:2009/43198-2009/31626:13.11.2009' url=AnyHttpUrl('https://karararama.yargitay.gov.tr/') etag=None last_modified=None metadata={'chamber': '9.HD', 'e_no': '2009/43198', 'k_no': '2009/31626', 'decision_date': '13.11.2009', 'doc_id': '870862300'}
doc_id=yargitay:9.HD:2009/43198-2009/31626:2009-11-13 title='Karar' chunks=1 checksum=3d0ae83aa0...
  chunk[0] tokens=60 preview='[KAYNAK:Yargıtay|DAİRE:9.HD|E:2009/43198|K:2009/31626|T:2009-11-13] [METİN] 9. H'
----------------------------------------
ref: key='YARGITAY:9.HD:2009/43197-2009/31625:13.11.2009' url=AnyHttpUrl('https://karararama.yargitay.gov.tr/') etag=None last_modified=None metadata={'chamber': '9.HD', 'e_no': '2009/43197', 'k_no': '2009/31625', 'decision_date': '13.11.2009', 'doc_id': '870859600'}
doc_id=yargitay:9.HD:2009/43197-2009/31625:2009-11-13 title='Karar' chunks=1 checksum=96667c1cb5...
  chunk[0] tokens=67 preview='[KAYNAK:Yargıtay|DAİRE:9.HD|E:2009/43197|K:2009/31625|T:2009-11-13] [METİN] 9. H'
----------------------------------------
ref: key='YARGITAY:9.HD:2009/43195-2009/31624:13.11.2009' url=AnyHttpUrl('https://karararama.yargitay.gov.tr/') etag=None last_modified=None metadata={'chamber': '9.HD', 'e_no': '2009/43195', 'k_no': '2009/31624', 'decision_date': '13.11.2009', 'doc_id': '870858600'}
doc_id=yargitay:9.HD:2009/43195-2009/31624:2009-11-13 title='Karar' chunks=1 checksum=386acb38ae...
  chunk[0] tokens=74 preview='[KAYNAK:Yargıtay|DAİRE:9.HD|E:2009/43195|K:2009/31624|T:2009-11-13] [METİN] 9. H'
----------------------------------------
ref: key='YARGITAY:9.HD:2009/43194-2009/31623:13.11.2009' url=AnyHttpUrl('https://karararama.yargitay.gov.tr/') etag=None last_modified=None metadata={'chamber': '9.HD', 'e_no': '2009/43194', 'k_no': '2009/31623', 'decision_date': '13.11.2009', 'doc_id': '870870900'}
doc_id=yargitay:9.HD:2009/43194-2009/31623:2009-11-13 title='Karar' chunks=1 checksum=564101f798...
  chunk[0] tokens=66 preview='[KAYNAK:Yargıtay|DAİRE:9.HD|E:2009/43194|K:2009/31623|T:2009-11-13] [METİN] 9. H'
----------------------------------------
ref: key='YARGITAY:9.HD:2009/43193-2009/31622:13.11.2009' url=AnyHttpUrl('https://karararama.yargitay.gov.tr/') etag=None last_modified=None metadata={'chamber': '9.HD', 'e_no': '2009/43193', 'k_no': '2009/31622', 'decision_date': '13.11.2009', 'doc_id': '870896200'}
doc_id=yargitay:9.HD:2009/43193-2009/31622:2009-11-13 title='Karar' chunks=1 checksum=7d5d1d51eb...
  chunk[0] tokens=67 preview='[KAYNAK:Yargıtay|DAİRE:9.HD|E:2009/43193|K:2009/31622|T:2009-11-13] [METİN] 9. H'
----------------------------------------
ref: key='YARGITAY:9.HD:2009/43192-2009/31621:13.11.2009' url=AnyHttpUrl('https://karararama.yargitay.gov.tr/') etag=None last_modified=None metadata={'chamber': '9.HD', 'e_no': '2009/43192', 'k_no': '2009/31621', 'decision_date': '13.11.2009', 'doc_id': '870878000'}
doc_id=yargitay:9.HD:2009/43192-2009/31621:2009-11-13 title='Karar' chunks=1 checksum=f79f8f8957...
  chunk[0] tokens=64 preview='[KAYNAK:Yargıtay|DAİRE:9.HD|E:2009/43192|K:2009/31621|T:2009-11-13] [METİN] 9. H'
----------------------------------------
ref: key='YARGITAY:9.HD:2009/43191-2009/31620:13.11.2009' url=AnyHttpUrl('https://karararama.yargitay.gov.tr/') etag=None last_modified=None metadata={'chamber': '9.HD', 'e_no': '2009/43191', 'k_no': '2009/31620', 'decision_date': '13.11.2009', 'doc_id': '870920800'}
doc_id=yargitay:9.HD:2009/43191-2009/31620:2009-11-13 title='Karar' chunks=1 checksum=c2f36b7f3b...
  chunk[0] tokens=104 preview='[KAYNAK:Yargıtay|DAİRE:9.HD|E:2009/43191|K:2009/31620|T:2009-11-13] [METİN] 9. H'
----------------------------------------
ref: key='YARGITAY:9.HD:2009/43190-2009/31619:13.11.2009' url=AnyHttpUrl('https://karararama.yargitay.gov.tr/') etag=None last_modified=None metadata={'chamber': '9.HD', 'e_no': '2009/43190', 'k_no': '2009/31619', 'decision_date': '13.11.2009', 'doc_id': '870861600'}
doc_id=yargitay:9.HD:2009/43190-2009/31619:2009-11-13 title='Karar' chunks=1 checksum=d6a1028a94...
  chunk[0] tokens=61 preview='[KAYNAK:Yargıtay|DAİRE:9.HD|E:2009/43190|K:2009/31619|T:2009-11-13] [METİN] 9. H'
----------------------------------------
ref: key='YARGITAY:9.HD:2009/43189-2009/31618:13.11.2009' url=AnyHttpUrl('https://karararama.yargitay.gov.tr/') etag=None last_modified=None metadata={'chamber': '9.HD', 'e_no': '2009/43189', 'k_no': '2009/31618', 'decision_date': '13.11.2009', 'doc_id': '870857700'}
doc_id=yargitay:9.HD:2009/43189-2009/31618:2009-11-13 title='Karar' chunks=1 checksum=941c2e524e...
  chunk[0] tokens=65 preview='[KAYNAK:Yargıtay|DAİRE:9.HD|E:2009/43189|K:2009/31618|T:2009-11-13] [METİN] 9. H'
----------------------------------------
ref: key='YARGITAY:9.HD:2009/43188-2009/31617:13.11.2009' url=AnyHttpUrl('https://karararama.yargitay.gov.tr/') etag=None last_modified=None metadata={'chamber': '9.HD', 'e_no': '2009/43188', 'k_no': '2009/31617', 'decision_date': '13.11.2009', 'doc_id': '870901300'}
doc_id=yargitay:9.HD:2009/43188-2009/31617:2009-11-13 title='Karar' chunks=1 checksum=e90e5c8978...
  chunk[0] tokens=65 preview='[KAYNAK:Yargıtay|DAİRE:9.HD|E:2009/43188|K:2009/31617|T:2009-11-13] [METİN] 9. H'
----------------------------------------
ref: key='YARGITAY:9.HD:2009/43187-2009/31616:13.11.2009' url=AnyHttpUrl('https://karararama.yargitay.gov.tr/') etag=None last_modified=None metadata={'chamber': '9.HD', 'e_no': '2009/43187', 'k_no': '2009/31616', 'decision_date': '13.11.2009', 'doc_id': '870913300'}
doc_id=yargitay:9.HD:2009/43187-2009/31616:2009-11-13 title='Karar' chunks=1 checksum=c0a4d7f1b6...
  chunk[0] tokens=83 preview='[KAYNAK:Yargıtay|DAİRE:9.HD|E:2009/43187|K:2009/31616|T:2009-11-13] [METİN] 9. H'
----------------------------------------
ref: key='YARGITAY:9.HD:2009/43180-2009/31615:13.11.2009' url=AnyHttpUrl('https://karararama.yargitay.gov.tr/') etag=None last_modified=None metadata={'chamber': '9.HD', 'e_no': '2009/43180', 'k_no': '2009/31615', 'decision_date': '13.11.2009', 'doc_id': '870924800'}
doc_id=yargitay:9.HD:2009/43180-2009/31615:2009-11-13 title='Karar' chunks=1 checksum=61e159facc...
  chunk[0] tokens=103 preview='[KAYNAK:Yargıtay|DAİRE:9.HD|E:2009/43180|K:2009/31615|T:2009-11-13] [METİN] 9. H'
----------------------------------------
ref: key='YARGITAY:9.HD:2009/43179-2009/31614:13.11.2009' url=AnyHttpUrl('https://karararama.yargitay.gov.tr/') etag=None last_modified=None metadata={'chamber': '9.HD', 'e_no': '2009/43179', 'k_no': '2009/31614', 'decision_date': '13.11.2009', 'doc_id': '870952700'}
doc_id=yargitay:9.HD:2009/43179-2009/31614:2009-11-13 title='Karar' chunks=1 checksum=acdf55ad01...
  chunk[0] tokens=96 preview='[KAYNAK:Yargıtay|DAİRE:9.HD|E:2009/43179|K:2009/31614|T:2009-11-13] [METİN] 9. H'
----------------------------------------
ref: key='YARGITAY:9.HD:2009/43177-2009/31613:13.11.2009' url=AnyHttpUrl('https://karararama.yargitay.gov.tr/') etag=None last_modified=None metadata={'chamber': '9.HD', 'e_no': '2009/43177', 'k_no': '2009/31613', 'decision_date': '13.11.2009', 'doc_id': '870909500'}
doc_id=yargitay:9.HD:2009/43177-2009/31613:2009-11-13 title='Karar' chunks=1 checksum=2412151506...
  chunk[0] tokens=67 preview='[KAYNAK:Yargıtay|DAİRE:9.HD|E:2009/43177|K:2009/31613|T:2009-11-13] [METİN] 9. H'
----------------------------------------
ref: key='YARGITAY:9.HD:2009/43169-2009/32243:17.11.2009' url=AnyHttpUrl('https://karararama.yargitay.gov.tr/') etag=None last_modified=None metadata={'chamber': '9.HD', 'e_no': '2009/43169', 'k_no': '2009/32243', 'decision_date': '17.11.2009', 'doc_id': '870871700'}
doc_id=yargitay:9.HD:2009/43169-2009/32243:2009-11-17 title='Karar' chunks=1 checksum=74fb1dc3a3...
  chunk[0] tokens=94 preview='[KAYNAK:Yargıtay|DAİRE:9.HD|E:2009/43169|K:2009/32243|T:2009-11-17] [METİN] 9. H'
----------------------------------------
ref: key='YARGITAY:9.HD:2009/42957-2009/32242:17.11.2009' url=AnyHttpUrl('https://karararama.yargitay.gov.tr/') etag=None last_modified=None metadata={'chamber': '9.HD', 'e_no': '2009/42957', 'k_no': '2009/32242', 'decision_date': '17.11.2009', 'doc_id': '870876900'}
doc_id=yargitay:9.HD:2009/42957-2009/32242:2009-11-17 title='Karar' chunks=1 checksum=8bcfe2dcf7...
  chunk[0] tokens=89 preview='[KAYNAK:Yargıtay|DAİRE:9.HD|E:2009/42957|K:2009/32242|T:2009-11-17] [METİN] 9. H'
----------------------------------------
ref: key='YARGITAY:9.HD:2009/42956-2009/32250:17.11.2009' url=AnyHttpUrl('https://karararama.yargitay.gov.tr/') etag=None last_modified=None metadata={'chamber': '9.HD', 'e_no': '2009/42956', 'k_no': '2009/32250', 'decision_date': '17.11.2009', 'doc_id': '870876200'}
doc_id=yargitay:9.HD:2009/42956-2009/32250:2009-11-17 title='Karar' chunks=1 checksum=b0d857e8f7...
  chunk[0] tokens=90 preview='[KAYNAK:Yargıtay|DAİRE:9.HD|E:2009/42956|K:2009/32250|T:2009-11-17] [METİN] 9. H'
----------------------------------------
ref: key='YARGITAY:9.HD:2009/42942-2009/31612:13.11.2009' url=AnyHttpUrl('https://karararama.yargitay.gov.tr/') etag=None last_modified=None metadata={'chamber': '9.HD', 'e_no': '2009/42942', 'k_no': '2009/31612', 'decision_date': '13.11.2009', 'doc_id': '870857000'}
doc_id=yargitay:9.HD:2009/42942-2009/31612:2009-11-13 title='Karar' chunks=1 checksum=4dd0b5deed...
  chunk[0] tokens=60 preview='[KAYNAK:Yargıtay|DAİRE:9.HD|E:2009/42942|K:2009/31612|T:2009-11-13] [METİN] 9. H'
----------------------------------------
ref: key='YARGITAY:9.HD:2009/42940-2009/31611:13.11.2009' url=AnyHttpUrl('https://karararama.yargitay.gov.tr/') etag=None last_modified=None metadata={'chamber': '9.HD', 'e_no': '2009/42940', 'k_no': '2009/31611', 'decision_date': '13.11.2009', 'doc_id': '870870500'}
doc_id=yargitay:9.HD:2009/42940-2009/31611:2009-11-13 title='Karar' chunks=1 checksum=a1466001da...
  chunk[0] tokens=45 preview='[KAYNAK:Yargıtay|DAİRE:9.HD|E:2009/42940|K:2009/31611|T:2009-11-13] [METİN] 9. H'
----------------------------------------
ref: key='YARGITAY:9.HD:2009/42939-2009/31610:13.11.2009' url=AnyHttpUrl('https://karararama.yargitay.gov.tr/') etag=None last_modified=None metadata={'chamber': '9.HD', 'e_no': '2009/42939', 'k_no': '2009/31610', 'decision_date': '13.11.2009', 'doc_id': '870887700'}
doc_id=yargitay:9.HD:2009/42939-2009/31610:2009-11-13 title='Karar' chunks=1 checksum=7cd9a51951...
  chunk[0] tokens=62 preview='[KAYNAK:Yargıtay|DAİRE:9.HD|E:2009/42939|K:2009/31610|T:2009-11-13] [METİN] 9. H'
----------------------------------------
ref: key='YARGITAY:9.HD:2009/42938-2009/31609:13.11.2009' url=AnyHttpUrl('https://karararama.yargitay.gov.tr/') etag=None last_modified=None metadata={'chamber': '9.HD', 'e_no': '2009/42938', 'k_no': '2009/31609', 'decision_date': '13.11.2009', 'doc_id': '870904000'}
doc_id=yargitay:9.HD:2009/42938-2009/31609:2009-11-13 title='Karar' chunks=1 checksum=f018d53bde...
  chunk[0] tokens=74 preview='[KAYNAK:Yargıtay|DAİRE:9.HD|E:2009/42938|K:2009/31609|T:2009-11-13] [METİN] 9. H'
----------------------------------------
ref: key='YARGITAY:9.HD:2009/42937-2009/31608:13.11.2009' url=AnyHttpUrl('https://karararama.yargitay.gov.tr/') etag=None last_modified=None metadata={'chamber': '9.HD', 'e_no': '2009/42937', 'k_no': '2009/31608', 'decision_date': '13.11.2009', 'doc_id': '870856400'}
doc_id=yargitay:9.HD:2009/42937-2009/31608:2009-11-13 title='Karar' chunks=1 checksum=1cd1b7a2ac...
  chunk[0] tokens=113 preview='[KAYNAK:Yargıtay|DAİRE:9.HD|E:2009/42937|K:2009/31608|T:2009-11-13] [METİN] 9. H'
----------------------------------------
ref: key='YARGITAY:9.HD:2009/42936-2009/31607:13.11.2009' url=AnyHttpUrl('https://karararama.yargitay.gov.tr/') etag=None last_modified=None metadata={'chamber': '9.HD', 'e_no': '2009/42936', 'k_no': '2009/31607', 'decision_date': '13.11.2009', 'doc_id': '870899100'}
doc_id=yargitay:9.HD:2009/42936-2009/31607:2009-11-13 title='Karar' chunks=1 checksum=b40ad4d9df...
  chunk[0] tokens=66 preview='[KAYNAK:Yargıtay|DAİRE:9.HD|E:2009/42936|K:2009/31607|T:2009-11-13] [METİN] 9. H'
----------------------------------------
ref: key='YARGITAY:9.HD:2009/42935-2009/31606:13.11.2009' url=AnyHttpUrl('https://karararama.yargitay.gov.tr/') etag=None last_modified=None metadata={'chamber': '9.HD', 'e_no': '2009/42935', 'k_no': '2009/31606', 'decision_date': '13.11.2009', 'doc_id': '870898500'}
doc_id=yargitay:9.HD:2009/42935-2009/31606:2009-11-13 title='Karar' chunks=1 checksum=6c86e92e6a...
  chunk[0] tokens=66 preview='[KAYNAK:Yargıtay|DAİRE:9.HD|E:2009/42935|K:2009/31606|T:2009-11-13] [METİN] 9. H'
----------------------------------------
ref: key='YARGITAY:9.HD:2009/42934-2009/31605:13.11.2009' url=AnyHttpUrl('https://karararama.yargitay.gov.tr/') etag=None last_modified=None metadata={'chamber': '9.HD', 'e_no': '2009/42934', 'k_no': '2009/31605', 'decision_date': '13.11.2009', 'doc_id': '870925400'}
doc_id=yargitay:9.HD:2009/42934-2009/31605:2009-11-13 title='Karar' chunks=1 checksum=d23969be0d...
  chunk[0] tokens=85 preview='[KAYNAK:Yargıtay|DAİRE:9.HD|E:2009/42934|K:2009/31605|T:2009-11-13] [METİN] 9. H'
----------------------------------------
ref: key='YARGITAY:9.HD:2009/42933-2009/31604:13.11.2009' url=AnyHttpUrl('https://karararama.yargitay.gov.tr/') etag=None last_modified=None metadata={'chamber': '9.HD', 'e_no': '2009/42933', 'k_no': '2009/31604', 'decision_date': '13.11.2009', 'doc_id': '870902100'}
doc_id=yargitay:9.HD:2009/42933-2009/31604:2009-11-13 title='Karar' chunks=1 checksum=8dc47dc1ce...
  chunk[0] tokens=63 preview='[KAYNAK:Yargıtay|DAİRE:9.HD|E:2009/42933|K:2009/31604|T:2009-11-13] [METİN] 9. H'
----------------------------------------
ref: key='YARGITAY:9.HD:2009/42932-2009/31603:13.11.2009' url=AnyHttpUrl('https://karararama.yargitay.gov.tr/') etag=None last_modified=None metadata={'chamber': '9.HD', 'e_no': '2009/42932', 'k_no': '2009/31603', 'decision_date': '13.11.2009', 'doc_id': '870900500'}
doc_id=yargitay:9.HD:2009/42932-2009/31603:2009-11-13 title='Karar' chunks=1 checksum=7c4c5fb341...
  chunk[0] tokens=63 preview='[KAYNAK:Yargıtay|DAİRE:9.HD|E:2009/42932|K:2009/31603|T:2009-11-13] [METİN] 9. H'
----------------------------------------
ref: key='YARGITAY:9.HD:2009/42931-2009/31602:13.11.2009' url=AnyHttpUrl('https://karararama.yargitay.gov.tr/') etag=None last_modified=None metadata={'chamber': '9.HD', 'e_no': '2009/42931', 'k_no': '2009/31602', 'decision_date': '13.11.2009', 'doc_id': '870860900'}
doc_id=yargitay:9.HD:2009/42931-2009/31602:2009-11-13 title='Karar' chunks=1 checksum=d5d9d53369...
  chunk[0] tokens=64 preview='[KAYNAK:Yargıtay|DAİRE:9.HD|E:2009/42931|K:2009/31602|T:2009-11-13] [METİN] 9. H'
----------------------------------------
ref: key='YARGITAY:9.HD:2009/42930-2009/31601:13.11.2009' url=AnyHttpUrl('https://karararama.yargitay.gov.tr/') etag=None last_modified=None metadata={'chamber': '9.HD', 'e_no': '2009/42930', 'k_no': '2009/31601', 'decision_date': '13.11.2009', 'doc_id': '870943500'}
doc_id=yargitay:9.HD:2009/42930-2009/31601:2009-11-13 title='Karar' chunks=1 checksum=a0d9381e3e...
  chunk[0] tokens=77 preview='[KAYNAK:Yargıtay|DAİRE:9.HD|E:2009/42930|K:2009/31601|T:2009-11-13] [METİN] 9. H'
----------------------------------------
ref: key='YARGITAY:9.HD:2009/42928-2009/31600:13.11.2009' url=AnyHttpUrl('https://karararama.yargitay.gov.tr/') etag=None last_modified=None metadata={'chamber': '9.HD', 'e_no': '2009/42928', 'k_no': '2009/31600', 'decision_date': '13.11.2009', 'doc_id': '870873700'}
doc_id=yargitay:9.HD:2009/42928-2009/31600:2009-11-13 title='Karar' chunks=1 checksum=f7a45edcfe...
  chunk[0] tokens=115 preview='[KAYNAK:Yargıtay|DAİRE:9.HD|E:2009/42928|K:2009/31600|T:2009-11-13] [METİN] 9. H'
----------------------------------------
ref: key='YARGITAY:9.HD:2009/42927-2009/31599:13.11.2009' url=AnyHttpUrl('https://karararama.yargitay.gov.tr/') etag=None last_modified=None metadata={'chamber': '9.HD', 'e_no': '2009/42927', 'k_no': '2009/31599', 'decision_date': '13.11.2009', 'doc_id': '870870200'}
doc_id=yargitay:9.HD:2009/42927-2009/31599:2009-11-13 title='Karar' chunks=1 checksum=5fa1a4e6fd...
  chunk[0] tokens=61 preview='[KAYNAK:Yargıtay|DAİRE:9.HD|E:2009/42927|K:2009/31599|T:2009-11-13] [METİN] 9. H'
----------------------------------------
ref: key='YARGITAY:9.HD:2009/42926-2009/31598:13.11.2009' url=AnyHttpUrl('https://karararama.yargitay.gov.tr/') etag=None last_modified=None metadata={'chamber': '9.HD', 'e_no': '2009/42926', 'k_no': '2009/31598', 'decision_date': '13.11.2009', 'doc_id': '870895700'}
doc_id=yargitay:9.HD:2009/42926-2009/31598:2009-11-13 title='Karar' chunks=1 checksum=36ba2da66a...
  chunk[0] tokens=62 preview='[KAYNAK:Yargıtay|DAİRE:9.HD|E:2009/42926|K:2009/31598|T:2009-11-13] [METİN] 9. H'
----------------------------------------
ref: key='YARGITAY:9.HD:2009/42925-2009/31597:13.11.2009' url=AnyHttpUrl('https://karararama.yargitay.gov.tr/') etag=None last_modified=None metadata={'chamber': '9.HD', 'e_no': '2009/42925', 'k_no': '2009/31597', 'decision_date': '13.11.2009', 'doc_id': '870855300'}
doc_id=yargitay:9.HD:2009/42925-2009/31597:2009-11-13 title='Karar' chunks=1 checksum=9cf1dbd330...
  chunk[0] tokens=77 preview='[KAYNAK:Yargıtay|DAİRE:9.HD|E:2009/42925|K:2009/31597|T:2009-11-13] [METİN] 9. H'
----------------------------------------
ref: key='YARGITAY:9.HD:2009/42924-2009/31596:13.11.2009' url=AnyHttpUrl('https://karararama.yargitay.gov.tr/') etag=None last_modified=None metadata={'chamber': '9.HD', 'e_no': '2009/42924', 'k_no': '2009/31596', 'decision_date': '13.11.2009', 'doc_id': '870936700'}
doc_id=yargitay:9.HD:2009/42924-2009/31596:2009-11-13 title='Karar' chunks=1 checksum=7ffc2236ca...
  chunk[0] tokens=86 preview='[KAYNAK:Yargıtay|DAİRE:9.HD|E:2009/42924|K:2009/31596|T:2009-11-13] [METİN] 9. H'
----------------------------------------
ref: key='YARGITAY:9.HD:2009/42923-2009/31595:13.11.2009' url=AnyHttpUrl('https://karararama.yargitay.gov.tr/') etag=None last_modified=None metadata={'chamber': '9.HD', 'e_no': '2009/42923', 'k_no': '2009/31595', 'decision_date': '13.11.2009', 'doc_id': '870888100'}
doc_id=yargitay:9.HD:2009/42923-2009/31595:2009-11-13 title='Karar' chunks=1 checksum=ab4088341a...
  chunk[0] tokens=61 preview='[KAYNAK:Yargıtay|DAİRE:9.HD|E:2009/42923|K:2009/31595|T:2009-11-13] [METİN] 9. H'
----------------------------------------
ref: key='YARGITAY:9.HD:2009/42922-2009/31594:13.11.2009' url=AnyHttpUrl('https://karararama.yargitay.gov.tr/') etag=None last_modified=None metadata={'chamber': '9.HD', 'e_no': '2009/42922', 'k_no': '2009/31594', 'decision_date': '13.11.2009', 'doc_id': '870898000'}
doc_id=yargitay:9.HD:2009/42922-2009/31594:2009-11-13 title='Karar' chunks=1 checksum=1aa170f35c...
  chunk[0] tokens=63 preview='[KAYNAK:Yargıtay|DAİRE:9.HD|E:2009/42922|K:2009/31594|T:2009-11-13] [METİN] 9. H'
----------------------------------------
ref: key='YARGITAY:9.HD:2009/42921-2009/31593:13.11.2009' url=AnyHttpUrl('https://karararama.yargitay.gov.tr/') etag=None last_modified=None metadata={'chamber': '9.HD', 'e_no': '2009/42921', 'k_no': '2009/31593', 'decision_date': '13.11.2009', 'doc_id': '870910500'}
doc_id=yargitay:9.HD:2009/42921-2009/31593:2009-11-13 title='Karar' chunks=1 checksum=92b2d7fe2d...
  chunk[0] tokens=115 preview='[KAYNAK:Yargıtay|DAİRE:9.HD|E:2009/42921|K:2009/31593|T:2009-11-13] [METİN] 9. H'
----------------------------------------
ref: key='YARGITAY:9.HD:2009/42913-2009/31592:13.11.2009' url=AnyHttpUrl('https://karararama.yargitay.gov.tr/') etag=None last_modified=None metadata={'chamber': '9.HD', 'e_no': '2009/42913', 'k_no': '2009/31592', 'decision_date': '13.11.2009', 'doc_id': '870934700'}
doc_id=yargitay:9.HD:2009/42913-2009/31592:2009-11-13 title='Karar' chunks=1 checksum=fcd3451178...
  chunk[0] tokens=85 preview='[KAYNAK:Yargıtay|DAİRE:9.HD|E:2009/42913|K:2009/31592|T:2009-11-13] [METİN] 9. H'
----------------------------------------
ref: key='YARGITAY:2.CD:2009/42855-2009/45875:07.12.2009' url=AnyHttpUrl('https://karararama.yargitay.gov.tr/') etag=None last_modified=None metadata={'chamber': '2.CD', 'e_no': '2009/42855', 'k_no': '2009/45875', 'decision_date': '07.12.2009', 'doc_id': '16875400'}
doc_id=yargitay:2.CD:2009/42855-2009/45875:2009-12-07 title='Karar' chunks=1 checksum=d9b44a380f...
  chunk[0] tokens=217 preview='[KAYNAK:Yargıtay|DAİRE:2.CD|E:2009/42855|K:2009/45875|T:2009-12-07] [METİN] "İçt'
----------------------------------------
ref: key='YARGITAY:9.HD:2009/42111-2009/32165:17.11.2009' url=AnyHttpUrl('https://karararama.yargitay.gov.tr/') etag=None last_modified=None metadata={'chamber': '9.HD', 'e_no': '2009/42111', 'k_no': '2009/32165', 'decision_date': '17.11.2009', 'doc_id': '870975200'}
doc_id=yargitay:9.HD:2009/42111-2009/32165:2009-11-17 title='Karar' chunks=1 checksum=44e94a73bd...
  chunk[0] tokens=94 preview='[KAYNAK:Yargıtay|DAİRE:9.HD|E:2009/42111|K:2009/32165|T:2009-11-17] [METİN] 9. H'
----------------------------------------
ref: key='YARGITAY:9.HD:2009/42110-2009/32164:17.11.2009' url=AnyHttpUrl('https://karararama.yargitay.gov.tr/') etag=None last_modified=None metadata={'chamber': '9.HD', 'e_no': '2009/42110', 'k_no': '2009/32164', 'decision_date': '17.11.2009', 'doc_id': '870959500'}
doc_id=yargitay:9.HD:2009/42110-2009/32164:2009-11-17 title='Karar' chunks=1 checksum=d63873dd7c...
  chunk[0] tokens=94 preview='[KAYNAK:Yargıtay|DAİRE:9.HD|E:2009/42110|K:2009/32164|T:2009-11-17] [METİN] 9. H'
----------------------------------------
ref: key='YARGITAY:9.HD:2009/42109-2009/32163:17.11.2009' url=AnyHttpUrl('https://karararama.yargitay.gov.tr/') etag=None last_modified=None metadata={'chamber': '9.HD', 'e_no': '2009/42109', 'k_no': '2009/32163', 'decision_date': '17.11.2009', 'doc_id': '870973800'}
doc_id=yargitay:9.HD:2009/42109-2009/32163:2009-11-17 title='Karar' chunks=1 checksum=e54ace9db5...
  chunk[0] tokens=94 preview='[KAYNAK:Yargıtay|DAİRE:9.HD|E:2009/42109|K:2009/32163|T:2009-11-17] [METİN] 9. H'
----------------------------------------
2025-11-20 01:16:51 [warning  ] yargitay_detail_error          attempt=1 error=Page.wait_for_selector: Timeout 30000ms exceeded.
Call log:
  - waiting for locator("table tbody tr") to be visible
 key=YARGITAY:9.HD:2009/42108-2009/32162:17.11.2009
ref: key='YARGITAY:9.HD:2009/42108-2009/32162:17.11.2009' url=AnyHttpUrl('https://karararama.yargitay.gov.tr/') etag=None last_modified=None metadata={'chamber': '9.HD', 'e_no': '2009/42108', 'k_no': '2009/32162', 'decision_date': '17.11.2009', 'doc_id': '870972600'}
doc_id=yargitay:9.HD:2009/42108-2009/32162:2009-11-17 title='Karar' chunks=1 checksum=80341d9674...
  chunk[0] tokens=94 preview='[KAYNAK:Yargıtay|DAİRE:9.HD|E:2009/42108|K:2009/32162|T:2009-11-17] [METİN] 9. H'
----------------------------------------
ref: key='YARGITAY:9.HD:2009/42107-2009/32161:17.11.2009' url=AnyHttpUrl('https://karararama.yargitay.gov.tr/') etag=None last_modified=None metadata={'chamber': '9.HD', 'e_no': '2009/42107', 'k_no': '2009/32161', 'decision_date': '17.11.2009', 'doc_id': '870971800'}
doc_id=yargitay:9.HD:2009/42107-2009/32161:2009-11-17 title='Karar' chunks=1 checksum=21c4f04740...
  chunk[0] tokens=94 preview='[KAYNAK:Yargıtay|DAİRE:9.HD|E:2009/42107|K:2009/32161|T:2009-11-17] [METİN] 9. H'
----------------------------------------
ref: key='YARGITAY:9.HD:2009/42106-2009/32160:17.11.2009' url=AnyHttpUrl('https://karararama.yargitay.gov.tr/') etag=None last_modified=None metadata={'chamber': '9.HD', 'e_no': '2009/42106', 'k_no': '2009/32160', 'decision_date': '17.11.2009', 'doc_id': '870971000'}
doc_id=yargitay:9.HD:2009/42106-2009/32160:2009-11-17 title='Karar' chunks=1 checksum=a6aee7675d...
  chunk[0] tokens=94 preview='[KAYNAK:Yargıtay|DAİRE:9.HD|E:2009/42106|K:2009/32160|T:2009-11-17] [METİN] 9. H'
----------------------------------------
ref: key='YARGITAY:9.HD:2009/42105-2009/32159:17.11.2009' url=AnyHttpUrl('https://karararama.yargitay.gov.tr/') etag=None last_modified=None metadata={'chamber': '9.HD', 'e_no': '2009/42105', 'k_no': '2009/32159', 'decision_date': '17.11.2009', 'doc_id': '870969900'}
doc_id=yargitay:9.HD:2009/42105-2009/32159:2009-11-17 title='Karar' chunks=1 checksum=cb07031631...
  chunk[0] tokens=94 preview='[KAYNAK:Yargıtay|DAİRE:9.HD|E:2009/42105|K:2009/32159|T:2009-11-17] [METİN] 9. H'
----------------------------------------
ref: key='YARGITAY:9.HD:2009/42104-2009/32158:17.11.2009' url=AnyHttpUrl('https://karararama.yargitay.gov.tr/') etag=None last_modified=None metadata={'chamber': '9.HD', 'e_no': '2009/42104', 'k_no': '2009/32158', 'decision_date': '17.11.2009', 'doc_id': '870966000'}
doc_id=yargitay:9.HD:2009/42104-2009/32158:2009-11-17 title='Karar' chunks=1 checksum=d609b207b2...
  chunk[0] tokens=94 preview='[KAYNAK:Yargıtay|DAİRE:9.HD|E:2009/42104|K:2009/32158|T:2009-11-17] [METİN] 9. H'
----------------------------------------
ref: key='YARGITAY:9.HD:2009/42103-2009/32157:17.11.2009' url=AnyHttpUrl('https://karararama.yargitay.gov.tr/') etag=None last_modified=None metadata={'chamber': '9.HD', 'e_no': '2009/42103', 'k_no': '2009/32157', 'decision_date': '17.11.2009', 'doc_id': '870964300'}
doc_id=yargitay:9.HD:2009/42103-2009/32157:2009-11-17 title='Karar' chunks=1 checksum=16807825e9...
  chunk[0] tokens=94 preview='[KAYNAK:Yargıtay|DAİRE:9.HD|E:2009/42103|K:2009/32157|T:2009-11-17] [METİN] 9. H'
----------------------------------------
ref: key='YARGITAY:9.HD:2009/42102-2009/32156:17.11.2009' url=AnyHttpUrl('https://karararama.yargitay.gov.tr/') etag=None last_modified=None metadata={'chamber': '9.HD', 'e_no': '2009/42102', 'k_no': '2009/32156', 'decision_date': '17.11.2009', 'doc_id': '870963200'}
doc_id=yargitay:9.HD:2009/42102-2009/32156:2009-11-17 title='Karar' chunks=1 checksum=92d3742be7...
  chunk[0] tokens=94 preview='[KAYNAK:Yargıtay|DAİRE:9.HD|E:2009/42102|K:2009/32156|T:2009-11-17] [METİN] 9. H'
----------------------------------------
ref: key='YARGITAY:9.HD:2009/42101-2009/32155:17.11.2009' url=AnyHttpUrl('https://karararama.yargitay.gov.tr/') etag=None last_modified=None metadata={'chamber': '9.HD', 'e_no': '2009/42101', 'k_no': '2009/32155', 'decision_date': '17.11.2009', 'doc_id': '870960500'}
doc_id=yargitay:9.HD:2009/42101-2009/32155:2009-11-17 title='Karar' chunks=1 checksum=6b00a55a7b...
  chunk[0] tokens=94 preview='[KAYNAK:Yargıtay|DAİRE:9.HD|E:2009/42101|K:2009/32155|T:2009-11-17] [METİN] 9. H'
----------------------------------------
ref: key='YARGITAY:9.HD:2009/42100-2009/32154:17.11.2009' url=AnyHttpUrl('https://karararama.yargitay.gov.tr/') etag=None last_modified=None metadata={'chamber': '9.HD', 'e_no': '2009/42100', 'k_no': '2009/32154', 'decision_date': '17.11.2009', 'doc_id': '870963800'}
doc_id=yargitay:9.HD:2009/42100-2009/32154:2009-11-17 title='Karar' chunks=1 checksum=3e64b73e74...
  chunk[0] tokens=94 preview='[KAYNAK:Yargıtay|DAİRE:9.HD|E:2009/42100|K:2009/32154|T:2009-11-17] [METİN] 9. H'
----------------------------------------
ref: key='YARGITAY:9.HD:2009/42099-2009/32153:17.11.2009' url=AnyHttpUrl('https://karararama.yargitay.gov.tr/') etag=None last_modified=None metadata={'chamber': '9.HD', 'e_no': '2009/42099', 'k_no': '2009/32153', 'decision_date': '17.11.2009', 'doc_id': '870962800'}
doc_id=yargitay:9.HD:2009/42099-2009/32153:2009-11-17 title='Karar' chunks=1 checksum=0d1bf811c2...
  chunk[0] tokens=94 preview='[KAYNAK:Yargıtay|DAİRE:9.HD|E:2009/42099|K:2009/32153|T:2009-11-17] [METİN] 9. H'
----------------------------------------
ref: key='YARGITAY:9.HD:2009/42098-2009/32152:17.11.2009' url=AnyHttpUrl('https://karararama.yargitay.gov.tr/') etag=None last_modified=None metadata={'chamber': '9.HD', 'e_no': '2009/42098', 'k_no': '2009/32152', 'decision_date': '17.11.2009', 'doc_id': '870961500'}
doc_id=yargitay:9.HD:2009/42098-2009/32152:2009-11-17 title='Karar' chunks=1 checksum=ee13427a92...
  chunk[0] tokens=94 preview='[KAYNAK:Yargıtay|DAİRE:9.HD|E:2009/42098|K:2009/32152|T:2009-11-17] [METİN] 9. H'
----------------------------------------
ref: key='YARGITAY:9.HD:2009/42097-2009/32151:17.11.2009' url=AnyHttpUrl('https://karararama.yargitay.gov.tr/') etag=None last_modified=None metadata={'chamber': '9.HD', 'e_no': '2009/42097', 'k_no': '2009/32151', 'decision_date': '17.11.2009', 'doc_id': '870961800'}
doc_id=yargitay:9.HD:2009/42097-2009/32151:2009-11-17 title='Karar' chunks=1 checksum=aa1b34571a...
  chunk[0] tokens=90 preview='[KAYNAK:Yargıtay|DAİRE:9.HD|E:2009/42097|K:2009/32151|T:2009-11-17] [METİN] 9. H'
----------------------------------------
ref: key='YARGITAY:9.HD:2009/41695-2009/31383:12.11.2009' url=AnyHttpUrl('https://karararama.yargitay.gov.tr/') etag=None last_modified=None metadata={'chamber': '9.HD', 'e_no': '2009/41695', 'k_no': '2009/31383', 'decision_date': '12.11.2009', 'doc_id': '870966500'}
doc_id=yargitay:9.HD:2009/41695-2009/31383:2009-11-12 title='Karar' chunks=1 checksum=cd48bdb015...
  chunk[0] tokens=97 preview='[KAYNAK:Yargıtay|DAİRE:9.HD|E:2009/41695|K:2009/31383|T:2009-11-12] [METİN] 9. H'
----------------------------------------
ref: key='YARGITAY:9.HD:2009/41655-2009/32246:17.11.2009' url=AnyHttpUrl('https://karararama.yargitay.gov.tr/') etag=None last_modified=None metadata={'chamber': '9.HD', 'e_no': '2009/41655', 'k_no': '2009/32246', 'decision_date': '17.11.2009', 'doc_id': '870939400'}
doc_id=yargitay:9.HD:2009/41655-2009/32246:2009-11-17 title='Karar' chunks=1 checksum=8b6be2d711...
  chunk[0] tokens=453 preview='[KAYNAK:Yargıtay|DAİRE:9.HD|E:2009/41655|K:2009/32246|T:2009-11-17] [METİN] 9. H'
----------------------------------------
ref: key='YARGITAY:9.HD:2009/41648-2009/31348:10.11.2009' url=AnyHttpUrl('https://karararama.yargitay.gov.tr/') etag=None last_modified=None metadata={'chamber': '9.HD', 'e_no': '2009/41648', 'k_no': '2009/31348', 'decision_date': '10.11.2009', 'doc_id': '870965400'}
doc_id=yargitay:9.HD:2009/41648-2009/31348:2009-11-10 title='Karar' chunks=1 checksum=22a3d70283...
  chunk[0] tokens=90 preview='[KAYNAK:Yargıtay|DAİRE:9.HD|E:2009/41648|K:2009/31348|T:2009-11-10] [METİN] 9. H'
----------------------------------------
ref: key='YARGITAY:9.HD:2009/41488-2009/30933:06.11.2009' url=AnyHttpUrl('https://karararama.yargitay.gov.tr/') etag=None last_modified=None metadata={'chamber': '9.HD', 'e_no': '2009/41488', 'k_no': '2009/30933', 'decision_date': '06.11.2009', 'doc_id': '870860500'}
doc_id=yargitay:9.HD:2009/41488-2009/30933:2009-11-06 title='Karar' chunks=1 checksum=b2176f6662...
  chunk[0] tokens=69 preview='[KAYNAK:Yargıtay|DAİRE:9.HD|E:2009/41488|K:2009/30933|T:2009-11-06] [METİN] 9. H'
----------------------------------------
ref: key='YARGITAY:9.HD:2009/41487-2009/30932:06.11.2009' url=AnyHttpUrl('https://karararama.yargitay.gov.tr/') etag=None last_modified=None metadata={'chamber': '9.HD', 'e_no': '2009/41487', 'k_no': '2009/30932', 'decision_date': '06.11.2009', 'doc_id': '870896800'}
doc_id=yargitay:9.HD:2009/41487-2009/30932:2009-11-06 title='Karar' chunks=1 checksum=61ec951dd0...
  chunk[0] tokens=68 preview='[KAYNAK:Yargıtay|DAİRE:9.HD|E:2009/41487|K:2009/30932|T:2009-11-06] [METİN] 9. H'
----------------------------------------
ref: key='YARGITAY:9.HD:2009/41486-2009/30931:06.11.2009' url=AnyHttpUrl('https://karararama.yargitay.gov.tr/') etag=None last_modified=None metadata={'chamber': '9.HD', 'e_no': '2009/41486', 'k_no': '2009/30931', 'decision_date': '06.11.2009', 'doc_id': '870922400'}
doc_id=yargitay:9.HD:2009/41486-2009/30931:2009-11-06 title='Karar' chunks=1 checksum=4af6abbfa4...
  chunk[0] tokens=102 preview='[KAYNAK:Yargıtay|DAİRE:9.HD|E:2009/41486|K:2009/30931|T:2009-11-06] [METİN] 9. H'
----------------------------------------
ref: key='YARGITAY:9.HD:2009/41485-2009/30930:06.11.2009' url=AnyHttpUrl('https://karararama.yargitay.gov.tr/') etag=None last_modified=None metadata={'chamber': '9.HD', 'e_no': '2009/41485', 'k_no': '2009/30930', 'decision_date': '06.11.2009', 'doc_id': '870938700'}
doc_id=yargitay:9.HD:2009/41485-2009/30930:2009-11-06 title='Karar' chunks=1 checksum=46f7238329...
  chunk[0] tokens=104 preview='[KAYNAK:Yargıtay|DAİRE:9.HD|E:2009/41485|K:2009/30930|T:2009-11-06] [METİN] 9. H'
----------------------------------------
ref: key='YARGITAY:9.HD:2009/41484-2009/30929:06.11.2009' url=AnyHttpUrl('https://karararama.yargitay.gov.tr/') etag=None last_modified=None metadata={'chamber': '9.HD', 'e_no': '2009/41484', 'k_no': '2009/30929', 'decision_date': '06.11.2009', 'doc_id': '870906700'}
doc_id=yargitay:9.HD:2009/41484-2009/30929:2009-11-06 title='Karar' chunks=1 checksum=d013baf8ca...
  chunk[0] tokens=60 preview='[KAYNAK:Yargıtay|DAİRE:9.HD|E:2009/41484|K:2009/30929|T:2009-11-06] [METİN] 9. H'
----------------------------------------
ref: key='YARGITAY:9.HD:2009/41483-2009/30928:06.11.2009' url=AnyHttpUrl('https://karararama.yargitay.gov.tr/') etag=None last_modified=None metadata={'chamber': '9.HD', 'e_no': '2009/41483', 'k_no': '2009/30928', 'decision_date': '06.11.2009', 'doc_id': '870915100'}
doc_id=yargitay:9.HD:2009/41483-2009/30928:2009-11-06 title='Karar' chunks=1 checksum=8299255526...
  chunk[0] tokens=75 preview='[KAYNAK:Yargıtay|DAİRE:9.HD|E:2009/41483|K:2009/30928|T:2009-11-06] [METİN] 9. H'
----------------------------------------
ref: key='YARGITAY:9.HD:2009/41482-2009/30927:06.11.2009' url=AnyHttpUrl('https://karararama.yargitay.gov.tr/') etag=None last_modified=None metadata={'chamber': '9.HD', 'e_no': '2009/41482', 'k_no': '2009/30927', 'decision_date': '06.11.2009', 'doc_id': '870923800'}
doc_id=yargitay:9.HD:2009/41482-2009/30927:2009-11-06 title='Karar' chunks=1 checksum=19723a3470...
  chunk[0] tokens=102 preview='[KAYNAK:Yargıtay|DAİRE:9.HD|E:2009/41482|K:2009/30927|T:2009-11-06] [METİN] 9. H'
----------------------------------------
ref: key='YARGITAY:9.HD:2009/41481-2009/30926:06.11.2009' url=AnyHttpUrl('https://karararama.yargitay.gov.tr/') etag=None last_modified=None metadata={'chamber': '9.HD', 'e_no': '2009/41481', 'k_no': '2009/30926', 'decision_date': '06.11.2009', 'doc_id': '870899300'}
doc_id=yargitay:9.HD:2009/41481-2009/30926:2009-11-06 title='Karar' chunks=1 checksum=d3129cca2b...
  chunk[0] tokens=60 preview='[KAYNAK:Yargıtay|DAİRE:9.HD|E:2009/41481|K:2009/30926|T:2009-11-06] [METİN] 9. H'
----------------------------------------
ref: key='YARGITAY:9.HD:2009/41480-2009/30925:06.11.2009' url=AnyHttpUrl('https://karararama.yargitay.gov.tr/') etag=None last_modified=None metadata={'chamber': '9.HD', 'e_no': '2009/41480', 'k_no': '2009/30925', 'decision_date': '06.11.2009', 'doc_id': '870879200'}
doc_id=yargitay:9.HD:2009/41480-2009/30925:2009-11-06 title='Karar' chunks=1 checksum=cfe29dd1d2...
  chunk[0] tokens=64 preview='[KAYNAK:Yargıtay|DAİRE:9.HD|E:2009/41480|K:2009/30925|T:2009-11-06] [METİN] 9. H'
----------------------------------------
ref: key='YARGITAY:9.HD:2009/41479-2009/30924:06.11.2009' url=AnyHttpUrl('https://karararama.yargitay.gov.tr/') etag=None last_modified=None metadata={'chamber': '9.HD', 'e_no': '2009/41479', 'k_no': '2009/30924', 'decision_date': '06.11.2009', 'doc_id': '870859000'}
doc_id=yargitay:9.HD:2009/41479-2009/30924:2009-11-06 title='Karar' chunks=1 checksum=a145a55d8c...
  chunk[0] tokens=63 preview='[KAYNAK:Yargıtay|DAİRE:9.HD|E:2009/41479|K:2009/30924|T:2009-11-06] [METİN] 9. H'
----------------------------------------
ref: key='YARGITAY:9.HD:2009/41478-2009/30923:06.11.2009' url=AnyHttpUrl('https://karararama.yargitay.gov.tr/') etag=None last_modified=None metadata={'chamber': '9.HD', 'e_no': '2009/41478', 'k_no': '2009/30923', 'decision_date': '06.11.2009', 'doc_id': '870940200'}
doc_id=yargitay:9.HD:2009/41478-2009/30923:2009-11-06 title='Karar' chunks=1 checksum=61f592efd0...
  chunk[0] tokens=104 preview='[KAYNAK:Yargıtay|DAİRE:9.HD|E:2009/41478|K:2009/30923|T:2009-11-06] [METİN] 9. H'
----------------------------------------
ref: key='YARGITAY:9.HD:2009/41477-2009/30922:06.11.2009' url=AnyHttpUrl('https://karararama.yargitay.gov.tr/') etag=None last_modified=None metadata={'chamber': '9.HD', 'e_no': '2009/41477', 'k_no': '2009/30922', 'decision_date': '06.11.2009', 'doc_id': '870877500'}
doc_id=yargitay:9.HD:2009/41477-2009/30922:2009-11-06 title='Karar' chunks=1 checksum=211f20df2e...
  chunk[0] tokens=67 preview='[KAYNAK:Yargıtay|DAİRE:9.HD|E:2009/41477|K:2009/30922|T:2009-11-06] [METİN] 9. H'
----------------------------------------
ref: key='YARGITAY:9.HD:2009/41476-2009/30921:06.11.2009' url=AnyHttpUrl('https://karararama.yargitay.gov.tr/') etag=None last_modified=None metadata={'chamber': '9.HD', 'e_no': '2009/41476', 'k_no': '2009/30921', 'decision_date': '06.11.2009', 'doc_id': '870933000'}
doc_id=yargitay:9.HD:2009/41476-2009/30921:2009-11-06 title='Karar' chunks=1 checksum=923df4dfd5...
  chunk[0] tokens=102 preview='[KAYNAK:Yargıtay|DAİRE:9.HD|E:2009/41476|K:2009/30921|T:2009-11-06] [METİN] 9. H'
----------------------------------------
ref: key='YARGITAY:9.HD:2009/41430-2009/32245:17.11.2009' url=AnyHttpUrl('https://karararama.yargitay.gov.tr/') etag=None last_modified=None metadata={'chamber': '9.HD', 'e_no': '2009/41430', 'k_no': '2009/32245', 'decision_date': '17.11.2009', 'doc_id': '870879600'}
doc_id=yargitay:9.HD:2009/41430-2009/32245:2009-11-17 title='Karar' chunks=1 checksum=e090abac05...
  chunk[0] tokens=90 preview='[KAYNAK:Yargıtay|DAİRE:9.HD|E:2009/41430|K:2009/32245|T:2009-11-17] [METİN] 9. H'
----------------------------------------
ref: key='YARGITAY:9.HD:2009/41320-2009/30920:06.11.2009' url=AnyHttpUrl('https://karararama.yargitay.gov.tr/') etag=None last_modified=None metadata={'chamber': '9.HD', 'e_no': '2009/41320', 'k_no': '2009/30920', 'decision_date': '06.11.2009', 'doc_id': '870877000'}
doc_id=yargitay:9.HD:2009/41320-2009/30920:2009-11-06 title='Karar' chunks=1 checksum=498ff89e92...
  chunk[0] tokens=67 preview='[KAYNAK:Yargıtay|DAİRE:9.HD|E:2009/41320|K:2009/30920|T:2009-11-06] [METİN] 9. H'
----------------------------------------
ref: key='YARGITAY:9.HD:2009/41319-2009/30919:06.11.2009' url=AnyHttpUrl('https://karararama.yargitay.gov.tr/') etag=None last_modified=None metadata={'chamber': '9.HD', 'e_no': '2009/41319', 'k_no': '2009/30919', 'decision_date': '06.11.2009', 'doc_id': '870856000'}
doc_id=yargitay:9.HD:2009/41319-2009/30919:2009-11-06 title='Karar' chunks=1 checksum=9e7b6b4119...
  chunk[0] tokens=66 preview='[KAYNAK:Yargıtay|DAİRE:9.HD|E:2009/41319|K:2009/30919|T:2009-11-06] [METİN] 9. H'
----------------------------------------
ref: key='YARGITAY:9.HD:2009/41318-2009/30918:06.11.2009' url=AnyHttpUrl('https://karararama.yargitay.gov.tr/') etag=None last_modified=None metadata={'chamber': '9.HD', 'e_no': '2009/41318', 'k_no': '2009/30918', 'decision_date': '06.11.2009', 'doc_id': '870906300'}
doc_id=yargitay:9.HD:2009/41318-2009/30918:2009-11-06 title='Karar' chunks=1 checksum=685b6dc215...
  chunk[0] tokens=72 preview='[KAYNAK:Yargıtay|DAİRE:9.HD|E:2009/41318|K:2009/30918|T:2009-11-06] [METİN] 9. H'
----------------------------------------
ref: key='YARGITAY:9.HD:2009/41317-2009/30917:06.11.2009' url=AnyHttpUrl('https://karararama.yargitay.gov.tr/') etag=None last_modified=None metadata={'chamber': '9.HD', 'e_no': '2009/41317', 'k_no': '2009/30917', 'decision_date': '06.11.2009', 'doc_id': '870934100'}
doc_id=yargitay:9.HD:2009/41317-2009/30917:2009-11-06 title='Karar' chunks=1 checksum=d887b33a98...
  chunk[0] tokens=68 preview='[KAYNAK:Yargıtay|DAİRE:9.HD|E:2009/41317|K:2009/30917|T:2009-11-06] [METİN] 9. H'
----------------------------------------
ref: key='YARGITAY:9.HD:2009/41316-2009/30916:06.11.2009' url=AnyHttpUrl('https://karararama.yargitay.gov.tr/') etag=None last_modified=None metadata={'chamber': '9.HD', 'e_no': '2009/41316', 'k_no': '2009/30916', 'decision_date': '06.11.2009', 'doc_id': '870917300'}
doc_id=yargitay:9.HD:2009/41316-2009/30916:2009-11-06 title='Karar' chunks=1 checksum=e30041f25d...
  chunk[0] tokens=75 preview='[KAYNAK:Yargıtay|DAİRE:9.HD|E:2009/41316|K:2009/30916|T:2009-11-06] [METİN] 9. H'
----------------------------------------
ref: key='YARGITAY:9.HD:2009/41315-2009/30915:06.11.2009' url=AnyHttpUrl('https://karararama.yargitay.gov.tr/') etag=None last_modified=None metadata={'chamber': '9.HD', 'e_no': '2009/41315', 'k_no': '2009/30915', 'decision_date': '06.11.2009', 'doc_id': '870875800'}
doc_id=yargitay:9.HD:2009/41315-2009/30915:2009-11-06 title='Karar' chunks=1 checksum=8e2b99460c...
  chunk[0] tokens=67 preview='[KAYNAK:Yargıtay|DAİRE:9.HD|E:2009/41315|K:2009/30915|T:2009-11-06] [METİN] 9. H'
----------------------------------------
ref: key='YARGITAY:9.HD:2009/41314-2009/30914:06.11.2009' url=AnyHttpUrl('https://karararama.yargitay.gov.tr/') etag=None last_modified=None metadata={'chamber': '9.HD', 'e_no': '2009/41314', 'k_no': '2009/30914', 'decision_date': '06.11.2009', 'doc_id': '870932000'}
doc_id=yargitay:9.HD:2009/41314-2009/30914:2009-11-06 title='Karar' chunks=1 checksum=b03ecff549...
  chunk[0] tokens=64 preview='[KAYNAK:Yargıtay|DAİRE:9.HD|E:2009/41314|K:2009/30914|T:2009-11-06] [METİN] 9. H'
----------------------------------------
ref: key='YARGITAY:9.HD:2009/41313-2009/30913:06.11.2009' url=AnyHttpUrl('https://karararama.yargitay.gov.tr/') etag=None last_modified=None metadata={'chamber': '9.HD', 'e_no': '2009/41313', 'k_no': '2009/30913', 'decision_date': '06.11.2009', 'doc_id': '870878800'}
doc_id=yargitay:9.HD:2009/41313-2009/30913:2009-11-06 title='Karar' chunks=1 checksum=4432bac421...
  chunk[0] tokens=67 preview='[KAYNAK:Yargıtay|DAİRE:9.HD|E:2009/41313|K:2009/30913|T:2009-11-06] [METİN] 9. H'
----------------------------------------
ref: key='YARGITAY:9.HD:2009/41310-2009/30883:06.11.2009' url=AnyHttpUrl('https://karararama.yargitay.gov.tr/') etag=None last_modified=None metadata={'chamber': '9.HD', 'e_no': '2009/41310', 'k_no': '2009/30883', 'decision_date': '06.11.2009', 'doc_id': '870958100'}
doc_id=yargitay:9.HD:2009/41310-2009/30883:2009-11-06 title='Karar' chunks=1 checksum=db1c70a393...
  chunk[0] tokens=92 preview='[KAYNAK:Yargıtay|DAİRE:9.HD|E:2009/41310|K:2009/30883|T:2009-11-06] [METİN] 9. H'
----------------------------------------
ref: key='YARGITAY:9.HD:2009/41306-2009/30881:06.11.2009' url=AnyHttpUrl('https://karararama.yargitay.gov.tr/') etag=None last_modified=None metadata={'chamber': '9.HD', 'e_no': '2009/41306', 'k_no': '2009/30881', 'decision_date': '06.11.2009', 'doc_id': '870957200'}
doc_id=yargitay:9.HD:2009/41306-2009/30881:2009-11-06 title='Karar' chunks=1 checksum=0bf3b6d34d...
  chunk[0] tokens=91 preview='[KAYNAK:Yargıtay|DAİRE:9.HD|E:2009/41306|K:2009/30881|T:2009-11-06] [METİN] 9. H'
----------------------------------------
ref: key='YARGITAY:9.HD:2009/41302-2009/30877:06.11.2009' url=AnyHttpUrl('https://karararama.yargitay.gov.tr/') etag=None last_modified=None metadata={'chamber': '9.HD', 'e_no': '2009/41302', 'k_no': '2009/30877', 'decision_date': '06.11.2009', 'doc_id': '870974800'}
doc_id=yargitay:9.HD:2009/41302-2009/30877:2009-11-06 title='Karar' chunks=1 checksum=613dc37a6f...
  chunk[0] tokens=357 preview='[KAYNAK:Yargıtay|DAİRE:9.HD|E:2009/41302|K:2009/30877|T:2009-11-06] [METİN] 9. H'
----------------------------------------
ref: key='YARGITAY:9.HD:2009/41301-2009/30876:06.11.2009' url=AnyHttpUrl('https://karararama.yargitay.gov.tr/') etag=None last_modified=None metadata={'chamber': '9.HD', 'e_no': '2009/41301', 'k_no': '2009/30876', 'decision_date': '06.11.2009', 'doc_id': '870973500'}
doc_id=yargitay:9.HD:2009/41301-2009/30876:2009-11-06 title='Karar' chunks=1 checksum=dd44c115a7...
  chunk[0] tokens=357 preview='[KAYNAK:Yargıtay|DAİRE:9.HD|E:2009/41301|K:2009/30876|T:2009-11-06] [METİN] 9. H'
----------------------------------------
ref: key='YARGITAY:9.HD:2009/40730-2009/31591:13.11.2009' url=AnyHttpUrl('https://karararama.yargitay.gov.tr/') etag=None last_modified=None metadata={'chamber': '9.HD', 'e_no': '2009/40730', 'k_no': '2009/31591', 'decision_date': '13.11.2009', 'doc_id': '870915900'}
doc_id=yargitay:9.HD:2009/40730-2009/31591:2009-11-13 title='Karar' chunks=1 checksum=24c16bf21d...
  chunk[0] tokens=81 preview='[KAYNAK:Yargıtay|DAİRE:9.HD|E:2009/40730|K:2009/31591|T:2009-11-13] [METİN] 9. H'
----------------------------------------
ref: key='YARGITAY:9.HD:2009/40725-2009/30912:06.11.2009' url=AnyHttpUrl('https://karararama.yargitay.gov.tr/') etag=None last_modified=None metadata={'chamber': '9.HD', 'e_no': '2009/40725', 'k_no': '2009/30912', 'decision_date': '06.11.2009', 'doc_id': '870879800'}
doc_id=yargitay:9.HD:2009/40725-2009/30912:2009-11-06 title='Karar' chunks=1 checksum=a2270cc6fc...
  chunk[0] tokens=68 preview='[KAYNAK:Yargıtay|DAİRE:9.HD|E:2009/40725|K:2009/30912|T:2009-11-06] [METİN] 9. H'
----------------------------------------
ref: key='YARGITAY:9.HD:2009/40724-2009/30911:06.11.2009' url=AnyHttpUrl('https://karararama.yargitay.gov.tr/') etag=None last_modified=None metadata={'chamber': '9.HD', 'e_no': '2009/40724', 'k_no': '2009/30911', 'decision_date': '06.11.2009', 'doc_id': '870889100'}
doc_id=yargitay:9.HD:2009/40724-2009/30911:2009-11-06 title='Karar' chunks=1 checksum=88e67a1447...
  chunk[0] tokens=59 preview='[KAYNAK:Yargıtay|DAİRE:9.HD|E:2009/40724|K:2009/30911|T:2009-11-06] [METİN] 9. H'
----------------------------------------
ref: key='YARGITAY:9.HD:2009/40723-2009/30910:06.11.2009' url=AnyHttpUrl('https://karararama.yargitay.gov.tr/') etag=None last_modified=None metadata={'chamber': '9.HD', 'e_no': '2009/40723', 'k_no': '2009/30910', 'decision_date': '06.11.2009', 'doc_id': '870872300'}
doc_id=yargitay:9.HD:2009/40723-2009/30910:2009-11-06 title='Karar' chunks=1 checksum=a81de48fd2...
  chunk[0] tokens=61 preview='[KAYNAK:Yargıtay|DAİRE:9.HD|E:2009/40723|K:2009/30910|T:2009-11-06] [METİN] 9. H'
----------------------------------------
ref: key='YARGITAY:9.HD:2009/40722-2009/30909:06.11.2009' url=AnyHttpUrl('https://karararama.yargitay.gov.tr/') etag=None last_modified=None metadata={'chamber': '9.HD', 'e_no': '2009/40722', 'k_no': '2009/30909', 'decision_date': '06.11.2009', 'doc_id': '870918200'}
doc_id=yargitay:9.HD:2009/40722-2009/30909:2009-11-06 title='Karar' chunks=1 checksum=0f08045bdf...
  chunk[0] tokens=103 preview='[KAYNAK:Yargıtay|DAİRE:9.HD|E:2009/40722|K:2009/30909|T:2009-11-06] [METİN] 9. H'
----------------------------------------
ref: key='YARGITAY:9.HD:2009/40721-2009/30908:06.11.2009' url=AnyHttpUrl('https://karararama.yargitay.gov.tr/') etag=None last_modified=None metadata={'chamber': '9.HD', 'e_no': '2009/40721', 'k_no': '2009/30908', 'decision_date': '06.11.2009', 'doc_id': '870891300'}
doc_id=yargitay:9.HD:2009/40721-2009/30908:2009-11-06 title='Karar' chunks=1 checksum=98b5ebc21d...
  chunk[0] tokens=72 preview='[KAYNAK:Yargıtay|DAİRE:9.HD|E:2009/40721|K:2009/30908|T:2009-11-06] [METİN] 9. H'
----------------------------------------
ref: key='YARGITAY:9.HD:2009/40720-2009/30907:06.11.2009' url=AnyHttpUrl('https://karararama.yargitay.gov.tr/') etag=None last_modified=None metadata={'chamber': '9.HD', 'e_no': '2009/40720', 'k_no': '2009/30907', 'decision_date': '06.11.2009', 'doc_id': '870855000'}
doc_id=yargitay:9.HD:2009/40720-2009/30907:2009-11-06 title='Karar' chunks=1 checksum=cf8db3c7b9...
  chunk[0] tokens=81 preview='[KAYNAK:Yargıtay|DAİRE:9.HD|E:2009/40720|K:2009/30907|T:2009-11-06] [METİN] 9. H'
----------------------------------------
ref: key='YARGITAY:9.HD:2009/40719-2009/30906:06.11.2009' url=AnyHttpUrl('https://karararama.yargitay.gov.tr/') etag=None last_modified=None metadata={'chamber': '9.HD', 'e_no': '2009/40719', 'k_no': '2009/30906', 'decision_date': '06.11.2009', 'doc_id': '870931400'}
doc_id=yargitay:9.HD:2009/40719-2009/30906:2009-11-06 title='Karar' chunks=1 checksum=f6f465a803...
  chunk[0] tokens=102 preview='[KAYNAK:Yargıtay|DAİRE:9.HD|E:2009/40719|K:2009/30906|T:2009-11-06] [METİN] 9. H'
----------------------------------------
ref: key='YARGITAY:9.HD:2009/40718-2009/30905:06.11.2009' url=AnyHttpUrl('https://karararama.yargitay.gov.tr/') etag=None last_modified=None metadata={'chamber': '9.HD', 'e_no': '2009/40718', 'k_no': '2009/30905', 'decision_date': '06.11.2009', 'doc_id': '870926200'}
doc_id=yargitay:9.HD:2009/40718-2009/30905:2009-11-06 title='Karar' chunks=1 checksum=fce50b4b72...
  chunk[0] tokens=103 preview='[KAYNAK:Yargıtay|DAİRE:9.HD|E:2009/40718|K:2009/30905|T:2009-11-06] [METİN] 9. H'
----------------------------------------
ref: key='YARGITAY:9.HD:2009/40716-2009/30904:06.11.2009' url=AnyHttpUrl('https://karararama.yargitay.gov.tr/') etag=None last_modified=None metadata={'chamber': '9.HD', 'e_no': '2009/40716', 'k_no': '2009/30904', 'decision_date': '06.11.2009', 'doc_id': '870921400'}
doc_id=yargitay:9.HD:2009/40716-2009/30904:2009-11-06 title='Karar' chunks=1 checksum=a9b1aee40f...
  chunk[0] tokens=86 preview='[KAYNAK:Yargıtay|DAİRE:9.HD|E:2009/40716|K:2009/30904|T:2009-11-06] [METİN] 9. H'
----------------------------------------
ref: key='YARGITAY:9.HD:2009/40715-2009/30903:06.11.2009' url=AnyHttpUrl('https://karararama.yargitay.gov.tr/') etag=None last_modified=None metadata={'chamber': '9.HD', 'e_no': '2009/40715', 'k_no': '2009/30903', 'decision_date': '06.11.2009', 'doc_id': '870946200'}
doc_id=yargitay:9.HD:2009/40715-2009/30903:2009-11-06 title='Karar' chunks=1 checksum=a94e29dc5c...
  chunk[0] tokens=72 preview='[KAYNAK:Yargıtay|DAİRE:9.HD|E:2009/40715|K:2009/30903|T:2009-11-06] [METİN] 9. H'
----------------------------------------
ref: key='YARGITAY:9.HD:2009/40714-2009/30902:06.11.2009' url=AnyHttpUrl('https://karararama.yargitay.gov.tr/') etag=None last_modified=None metadata={'chamber': '9.HD', 'e_no': '2009/40714', 'k_no': '2009/30902', 'decision_date': '06.11.2009', 'doc_id': '870905600'}
doc_id=yargitay:9.HD:2009/40714-2009/30902:2009-11-06 title='Karar' chunks=1 checksum=bdd1a18f08...
  chunk[0] tokens=62 preview='[KAYNAK:Yargıtay|DAİRE:9.HD|E:2009/40714|K:2009/30902|T:2009-11-06] [METİN] 9. H'
----------------------------------------
ref: key='YARGITAY:9.HD:2009/40504-2009/31590:13.11.2009' url=AnyHttpUrl('https://karararama.yargitay.gov.tr/') etag=None last_modified=None metadata={'chamber': '9.HD', 'e_no': '2009/40504', 'k_no': '2009/31590', 'decision_date': '13.11.2009', 'doc_id': '870919900'}
doc_id=yargitay:9.HD:2009/40504-2009/31590:2009-11-13 title='Karar' chunks=1 checksum=030b2a0876...
  chunk[0] tokens=85 preview='[KAYNAK:Yargıtay|DAİRE:9.HD|E:2009/40504|K:2009/31590|T:2009-11-13] [METİN] 9. H'
----------------------------------------
ref: key='YARGITAY:9.HD:2009/40358-2009/31995:16.11.2009' url=AnyHttpUrl('https://karararama.yargitay.gov.tr/') etag=None last_modified=None metadata={'chamber': '9.HD', 'e_no': '2009/40358', 'k_no': '2009/31995', 'decision_date': '16.11.2009', 'doc_id': '870951100'}
doc_id=yargitay:9.HD:2009/40358-2009/31995:2009-11-16 title='Karar' chunks=1 checksum=e1e79fc3ed...
  chunk[0] tokens=99 preview='[KAYNAK:Yargıtay|DAİRE:9.HD|E:2009/40358|K:2009/31995|T:2009-11-16] [METİN] 9. H'
----------------------------------------
ref: key='YARGITAY:9.HD:2009/40357-2009/31994:16.11.2009' url=AnyHttpUrl('https://karararama.yargitay.gov.tr/') etag=None last_modified=None metadata={'chamber': '9.HD', 'e_no': '2009/40357', 'k_no': '2009/31994', 'decision_date': '16.11.2009', 'doc_id': '870950400'}
doc_id=yargitay:9.HD:2009/40357-2009/31994:2009-11-16 title='Karar' chunks=1 checksum=79cb3aa4d3...
  chunk[0] tokens=99 preview='[KAYNAK:Yargıtay|DAİRE:9.HD|E:2009/40357|K:2009/31994|T:2009-11-16] [METİN] 9. H'
----------------------------------------
ref: key='YARGITAY:9.HD:2009/40356-2009/31993:16.11.2009' url=AnyHttpUrl('https://karararama.yargitay.gov.tr/') etag=None last_modified=None metadata={'chamber': '9.HD', 'e_no': '2009/40356', 'k_no': '2009/31993', 'decision_date': '16.11.2009', 'doc_id': '870949500'}
doc_id=yargitay:9.HD:2009/40356-2009/31993:2009-11-16 title='Karar' chunks=1 checksum=7c0630f194...
  chunk[0] tokens=99 preview='[KAYNAK:Yargıtay|DAİRE:9.HD|E:2009/40356|K:2009/31993|T:2009-11-16] [METİN] 9. H'
----------------------------------------
ref: key='YARGITAY:2.CD:2009/39898-2009/41370:04.11.2009' url=AnyHttpUrl('https://karararama.yargitay.gov.tr/') etag=None last_modified=None metadata={'chamber': '2.CD', 'e_no': '2009/39898', 'k_no': '2009/41370', 'decision_date': '04.11.2009', 'doc_id': '16875300'}
doc_id=yargitay:2.CD:2009/39898-2009/41370:2009-11-04 title='Karar' chunks=1 checksum=bb2a987da4...
  chunk[0] tokens=256 preview='[KAYNAK:Yargıtay|DAİRE:2.CD|E:2009/39898|K:2009/41370|T:2009-11-04] [METİN] "İçt'
----------------------------------------
ref: key='YARGITAY:9.HD:2009/37501-2009/29995:02.11.2009' url=AnyHttpUrl('https://karararama.yargitay.gov.tr/') etag=None last_modified=None metadata={'chamber': '9.HD', 'e_no': '2009/37501', 'k_no': '2009/29995', 'decision_date': '02.11.2009', 'doc_id': '16928300'}
doc_id=yargitay:9.HD:2009/37501-2009/29995:2009-11-02 title='Karar' chunks=1 checksum=fd26d46451...
  chunk[0] tokens=1713 preview='[KAYNAK:Yargıtay|DAİRE:9.HD|E:2009/37501|K:2009/29995|T:2009-11-02] [METİN] "İçt'
----------------------------------------
ref: key='YARGITAY:9.HD:2009/36598-2009/30182:03.11.2009' url=AnyHttpUrl('https://karararama.yargitay.gov.tr/') etag=None last_modified=None metadata={'chamber': '9.HD', 'e_no': '2009/36598', 'k_no': '2009/30182', 'decision_date': '03.11.2009', 'doc_id': '870949800'}
doc_id=yargitay:9.HD:2009/36598-2009/30182:2009-11-03 title='Karar' chunks=1 checksum=b6b55b385a...
  chunk[0] tokens=77 preview='[KAYNAK:Yargıtay|DAİRE:9.HD|E:2009/36598|K:2009/30182|T:2009-11-03] [METİN] 9. H'
----------------------------------------
ref: key='YARGITAY:9.HD:2009/36597-2009/30181:03.11.2009' url=AnyHttpUrl('https://karararama.yargitay.gov.tr/') etag=None last_modified=None metadata={'chamber': '9.HD', 'e_no': '2009/36597', 'k_no': '2009/30181', 'decision_date': '03.11.2009', 'doc_id': '870949100'}
doc_id=yargitay:9.HD:2009/36597-2009/30181:2009-11-03 title='Karar' chunks=1 checksum=72ffc41e16...
  chunk[0] tokens=77 preview='[KAYNAK:Yargıtay|DAİRE:9.HD|E:2009/36597|K:2009/30181|T:2009-11-03] [METİN] 9. H'
----------------------------------------
ref: key='YARGITAY:9.HD:2009/36596-2009/30180:03.11.2009' url=AnyHttpUrl('https://karararama.yargitay.gov.tr/') etag=None last_modified=None metadata={'chamber': '9.HD', 'e_no': '2009/36596', 'k_no': '2009/30180', 'decision_date': '03.11.2009', 'doc_id': '870951500'}
doc_id=yargitay:9.HD:2009/36596-2009/30180:2009-11-03 title='Karar' chunks=1 checksum=1ab8fe4008...
  chunk[0] tokens=77 preview='[KAYNAK:Yargıtay|DAİRE:9.HD|E:2009/36596|K:2009/30180|T:2009-11-03] [METİN] 9. H'
----------------------------------------
ref: key='YARGITAY:9.HD:2009/36595-2009/30179:03.11.2009' url=AnyHttpUrl('https://karararama.yargitay.gov.tr/') etag=None last_modified=None metadata={'chamber': '9.HD', 'e_no': '2009/36595', 'k_no': '2009/30179', 'decision_date': '03.11.2009', 'doc_id': '870950600'}
doc_id=yargitay:9.HD:2009/36595-2009/30179:2009-11-03 title='Karar' chunks=1 checksum=df9d978506...
  chunk[0] tokens=77 preview='[KAYNAK:Yargıtay|DAİRE:9.HD|E:2009/36595|K:2009/30179|T:2009-11-03] [METİN] 9. H'
----------------------------------------
ref: key='YARGITAY:9.HD:2009/36594-2009/30178:03.11.2009' url=AnyHttpUrl('https://karararama.yargitay.gov.tr/') etag=None last_modified=None metadata={'chamber': '9.HD', 'e_no': '2009/36594', 'k_no': '2009/30178', 'decision_date': '03.11.2009', 'doc_id': '870947800'}
doc_id=yargitay:9.HD:2009/36594-2009/30178:2009-11-03 title='Karar' chunks=1 checksum=26de0aabf0...
  chunk[0] tokens=77 preview='[KAYNAK:Yargıtay|DAİRE:9.HD|E:2009/36594|K:2009/30178|T:2009-11-03] [METİN] 9. H'
----------------------------------------
ref: key='YARGITAY:9.HD:2009/36525-2009/31158:09.11.2009' url=AnyHttpUrl('https://karararama.yargitay.gov.tr/') etag=None last_modified=None metadata={'chamber': '9.HD', 'e_no': '2009/36525', 'k_no': '2009/31158', 'decision_date': '09.11.2009', 'doc_id': '870959200'}
doc_id=yargitay:9.HD:2009/36525-2009/31158:2009-11-09 title='Karar' chunks=1 checksum=4f4d68cc0d...
  chunk[0] tokens=90 preview='[KAYNAK:Yargıtay|DAİRE:9.HD|E:2009/36525|K:2009/31158|T:2009-11-09] [METİN] 9. H'
----------------------------------------
ref: key='YARGITAY:9.HD:2009/36524-2009/31157:09.11.2009' url=AnyHttpUrl('https://karararama.yargitay.gov.tr/') etag=None last_modified=None metadata={'chamber': '9.HD', 'e_no': '2009/36524', 'k_no': '2009/31157', 'decision_date': '09.11.2009', 'doc_id': '870963500'}
doc_id=yargitay:9.HD:2009/36524-2009/31157:2009-11-09 title='Karar' chunks=1 checksum=b86421cc80...
  chunk[0] tokens=90 preview='[KAYNAK:Yargıtay|DAİRE:9.HD|E:2009/36524|K:2009/31157|T:2009-11-09] [METİN] 9. H'
----------------------------------------
ref: key='YARGITAY:9.HD:2009/36523-2009/31156:09.11.2009' url=AnyHttpUrl('https://karararama.yargitay.gov.tr/') etag=None last_modified=None metadata={'chamber': '9.HD', 'e_no': '2009/36523', 'k_no': '2009/31156', 'decision_date': '09.11.2009', 'doc_id': '870960000'}
doc_id=yargitay:9.HD:2009/36523-2009/31156:2009-11-09 title='Karar' chunks=1 checksum=c967fbd29d...
  chunk[0] tokens=90 preview='[KAYNAK:Yargıtay|DAİRE:9.HD|E:2009/36523|K:2009/31156|T:2009-11-09] [METİN] 9. H'
----------------------------------------
ref: key='YARGITAY:9.HD:2009/36522-2009/31155:09.11.2009' url=AnyHttpUrl('https://karararama.yargitay.gov.tr/') etag=None last_modified=None metadata={'chamber': '9.HD', 'e_no': '2009/36522', 'k_no': '2009/31155', 'decision_date': '09.11.2009', 'doc_id': '870962300'}
doc_id=yargitay:9.HD:2009/36522-2009/31155:2009-11-09 title='Karar' chunks=1 checksum=6559cfd77d...
  chunk[0] tokens=90 preview='[KAYNAK:Yargıtay|DAİRE:9.HD|E:2009/36522|K:2009/31155|T:2009-11-09] [METİN] 9. H'
----------------------------------------
ref: key='YARGITAY:9.HD:2009/36521-2009/31154:09.11.2009' url=AnyHttpUrl('https://karararama.yargitay.gov.tr/') etag=None last_modified=None metadata={'chamber': '9.HD', 'e_no': '2009/36521', 'k_no': '2009/31154', 'decision_date': '09.11.2009', 'doc_id': '870961600'}
doc_id=yargitay:9.HD:2009/36521-2009/31154:2009-11-09 title='Karar' chunks=1 checksum=79893efdbf...
  chunk[0] tokens=90 preview='[KAYNAK:Yargıtay|DAİRE:9.HD|E:2009/36521|K:2009/31154|T:2009-11-09] [METİN] 9. H'
----------------------------------------
ref: key='YARGITAY:9.HD:2009/36520-2009/31153:09.11.2009' url=AnyHttpUrl('https://karararama.yargitay.gov.tr/') etag=None last_modified=None metadata={'chamber': '9.HD', 'e_no': '2009/36520', 'k_no': '2009/31153', 'decision_date': '09.11.2009', 'doc_id': '870964600'}
doc_id=yargitay:9.HD:2009/36520-2009/31153:2009-11-09 title='Karar' chunks=1 checksum=9111e0c37d...
  chunk[0] tokens=90 preview='[KAYNAK:Yargıtay|DAİRE:9.HD|E:2009/36520|K:2009/31153|T:2009-11-09] [METİN] 9. H'
----------------------------------------
ref: key='YARGITAY:9.HD:2009/36519-2009/31152:09.11.2009' url=AnyHttpUrl('https://karararama.yargitay.gov.tr/') etag=None last_modified=None metadata={'chamber': '9.HD', 'e_no': '2009/36519', 'k_no': '2009/31152', 'decision_date': '09.11.2009', 'doc_id': '870960800'}
doc_id=yargitay:9.HD:2009/36519-2009/31152:2009-11-09 title='Karar' chunks=1 checksum=8c74223366...
  chunk[0] tokens=90 preview='[KAYNAK:Yargıtay|DAİRE:9.HD|E:2009/36519|K:2009/31152|T:2009-11-09] [METİN] 9. H'
----------------------------------------
ref: key='YARGITAY:9.HD:2009/36518-2009/31151:09.11.2009' url=AnyHttpUrl('https://karararama.yargitay.gov.tr/') etag=None last_modified=None metadata={'chamber': '9.HD', 'e_no': '2009/36518', 'k_no': '2009/31151', 'decision_date': '09.11.2009', 'doc_id': '870963900'}
doc_id=yargitay:9.HD:2009/36518-2009/31151:2009-11-09 title='Karar' chunks=1 checksum=fe50da789f...
  chunk[0] tokens=90 preview='[KAYNAK:Yargıtay|DAİRE:9.HD|E:2009/36518|K:2009/31151|T:2009-11-09] [METİN] 9. H'
----------------------------------------
ref: key='YARGITAY:2.CD:2009/36130-2009/48135:22.12.2009' url=AnyHttpUrl('https://karararama.yargitay.gov.tr/') etag=None last_modified=None metadata={'chamber': '2.CD', 'e_no': '2009/36130', 'k_no': '2009/48135', 'decision_date': '22.12.2009', 'doc_id': '16904200'}
doc_id=yargitay:2.CD:2009/36130-2009/48135:2009-12-22 title='Karar' chunks=1 checksum=88c0b01aef...
  chunk[0] tokens=175 preview='[KAYNAK:Yargıtay|DAİRE:2.CD|E:2009/36130|K:2009/48135|T:2009-12-22] [METİN] "İçt'
----------------------------------------
ref: key='YARGITAY:9.HD:2009/34583-2009/30791:06.11.2009' url=AnyHttpUrl('https://karararama.yargitay.gov.tr/') etag=None last_modified=None metadata={'chamber': '9.HD', 'e_no': '2009/34583', 'k_no': '2009/30791', 'decision_date': '06.11.2009', 'doc_id': '870874700'}
doc_id=yargitay:9.HD:2009/34583-2009/30791:2009-11-06 title='Karar' chunks=1 checksum=ed89e8304a...
  chunk[0] tokens=65 preview='[KAYNAK:Yargıtay|DAİRE:9.HD|E:2009/34583|K:2009/30791|T:2009-11-06] [METİN] 9. H'
----------------------------------------
ref: key='YARGITAY:12.HD:2009/34484-2009/20161:22.10.2009' url=AnyHttpUrl('https://karararama.yargitay.gov.tr/') etag=None last_modified=None metadata={'chamber': '12.HD', 'e_no': '2009/34484', 'k_no': '2009/20161', 'decision_date': '22.10.2009', 'doc_id': '60710300'}
doc_id=yargitay:12.HD:2009/34484-2009/20161:2009-10-22 title='Karar' chunks=1 checksum=50c0d39d97...
  chunk[0] tokens=102 preview='[KAYNAK:Yargıtay|DAİRE:12.HD|E:2009/34484|K:2009/20161|T:2009-10-22] [METİN] 12.'
----------------------------------------
ref: key='YARGITAY:9.HD:2009/33853-2009/25789:06.10.2009' url=AnyHttpUrl('https://karararama.yargitay.gov.tr/') etag=None last_modified=None metadata={'chamber': '9.HD', 'e_no': '2009/33853', 'k_no': '2009/25789', 'decision_date': '06.10.2009', 'doc_id': '16946000'}
doc_id=yargitay:9.HD:2009/33853-2009/25789:2009-10-06 title='Karar' chunks=1 checksum=817214f26f...
  chunk[0] tokens=1035 preview='[KAYNAK:Yargıtay|DAİRE:9.HD|E:2009/33853|K:2009/25789|T:2009-10-06] [METİN] 9. H'
----------------------------------------
ref: key='YARGITAY:2.CD:2009/32516-2009/33527:09.07.2009' url=AnyHttpUrl('https://karararama.yargitay.gov.tr/') etag=None last_modified=None metadata={'chamber': '2.CD', 'e_no': '2009/32516', 'k_no': '2009/33527', 'decision_date': '09.07.2009', 'doc_id': '16806000'}
doc_id=yargitay:2.CD:2009/32516-2009/33527:2009-07-09 title='Karar' chunks=1 checksum=56ea80d5a9...
  chunk[0] tokens=559 preview='[KAYNAK:Yargıtay|DAİRE:2.CD|E:2009/32516|K:2009/33527|T:2009-07-09] [METİN] "İçt'
----------------------------------------
ref: key='YARGITAY:2.CD:2009/32511-2009/33528:09.07.2009' url=AnyHttpUrl('https://karararama.yargitay.gov.tr/') etag=None last_modified=None metadata={'chamber': '2.CD', 'e_no': '2009/32511', 'k_no': '2009/33528', 'decision_date': '09.07.2009', 'doc_id': '16806200'}
doc_id=yargitay:2.CD:2009/32511-2009/33528:2009-07-09 title='Karar' chunks=1 checksum=0cacb8a879...
  chunk[0] tokens=240 preview='[KAYNAK:Yargıtay|DAİRE:2.CD|E:2009/32511|K:2009/33528|T:2009-07-09] [METİN] "İçt'
----------------------------------------
ref: key='YARGITAY:9.HD:2009/32059-2009/31083:09.11.2009' url=AnyHttpUrl('https://karararama.yargitay.gov.tr/') etag=None last_modified=None metadata={'chamber': '9.HD', 'e_no': '2009/32059', 'k_no': '2009/31083', 'decision_date': '09.11.2009', 'doc_id': '16934000'}
doc_id=yargitay:9.HD:2009/32059-2009/31083:2009-11-09 title='Karar' chunks=1 checksum=440d056b45...
  chunk[0] tokens=66 preview='[KAYNAK:Yargıtay|DAİRE:9.HD|E:2009/32059|K:2009/31083|T:2009-11-09] [METİN] "İçt'
----------------------------------------
ref: key='YARGITAY:9.HD:2009/31403-2009/23197:15.09.2009' url=AnyHttpUrl('https://karararama.yargitay.gov.tr/') etag=None last_modified=None metadata={'chamber': '9.HD', 'e_no': '2009/31403', 'k_no': '2009/23197', 'decision_date': '15.09.2009', 'doc_id': '16933900'}
doc_id=yargitay:9.HD:2009/31403-2009/23197:2009-09-15 title='Karar' chunks=1 checksum=148d5a84c9...
  chunk[0] tokens=534 preview='[KAYNAK:Yargıtay|DAİRE:9.HD|E:2009/31403|K:2009/23197|T:2009-09-15] [METİN] "İçt'
----------------------------------------
ref: key='YARGITAY:12.HD:2009/30498-2009/27023:30.12.2009' url=AnyHttpUrl('https://karararama.yargitay.gov.tr/') etag=None last_modified=None metadata={'chamber': '12.HD', 'e_no': '2009/30498', 'k_no': '2009/27023', 'decision_date': '30.12.2009', 'doc_id': '70294800'}
doc_id=yargitay:12.HD:2009/30498-2009/27023:2009-12-30 title='Karar' chunks=1 checksum=b5e04c0f77...
  chunk[0] tokens=47 preview='[KAYNAK:Yargıtay|DAİRE:12.HD|E:2009/30498|K:2009/27023|T:2009-12-30] [METİN] 12.'
----------------------------------------
ref: key='YARGITAY:12.HD:2009/30492-2009/27024:30.12.2009' url=AnyHttpUrl('https://karararama.yargitay.gov.tr/') etag=None last_modified=None metadata={'chamber': '12.HD', 'e_no': '2009/30492', 'k_no': '2009/27024', 'decision_date': '30.12.2009', 'doc_id': '70295300'}
doc_id=yargitay:12.HD:2009/30492-2009/27024:2009-12-30 title='Karar' chunks=1 checksum=cf8111bbc4...
  chunk[0] tokens=110 preview='[KAYNAK:Yargıtay|DAİRE:12.HD|E:2009/30492|K:2009/27024|T:2009-12-30] [METİN] 12.'
----------------------------------------
ref: key='YARGITAY:12.HD:2009/30467-2009/27025:30.12.2009' url=AnyHttpUrl('https://karararama.yargitay.gov.tr/') etag=None last_modified=None metadata={'chamber': '12.HD', 'e_no': '2009/30467', 'k_no': '2009/27025', 'decision_date': '30.12.2009', 'doc_id': '70295900'}
doc_id=yargitay:12.HD:2009/30467-2009/27025:2009-12-30 title='Karar' chunks=1 checksum=5e5ed1b245...
  chunk[0] tokens=79 preview='[KAYNAK:Yargıtay|DAİRE:12.HD|E:2009/30467|K:2009/27025|T:2009-12-30] [METİN] 12.'
----------------------------------------
ref: key='YARGITAY:12.HD:2009/30466-2009/27026:30.12.2009' url=AnyHttpUrl('https://karararama.yargitay.gov.tr/') etag=None last_modified=None metadata={'chamber': '12.HD', 'e_no': '2009/30466', 'k_no': '2009/27026', 'decision_date': '30.12.2009', 'doc_id': '70296400'}
doc_id=yargitay:12.HD:2009/30466-2009/27026:2009-12-30 title='Karar' chunks=1 checksum=39df557d89...
  chunk[0] tokens=49 preview='[KAYNAK:Yargıtay|DAİRE:12.HD|E:2009/30466|K:2009/27026|T:2009-12-30] [METİN] 12.'
----------------------------------------
ref: key='YARGITAY:12.HD:2009/30464-2009/27027:30.12.2009' url=AnyHttpUrl('https://karararama.yargitay.gov.tr/') etag=None last_modified=None metadata={'chamber': '12.HD', 'e_no': '2009/30464', 'k_no': '2009/27027', 'decision_date': '30.12.2009', 'doc_id': '70296700'}
doc_id=yargitay:12.HD:2009/30464-2009/27027:2009-12-30 title='Karar' chunks=1 checksum=5a82864593...
  chunk[0] tokens=105 preview='[KAYNAK:Yargıtay|DAİRE:12.HD|E:2009/30464|K:2009/27027|T:2009-12-30] [METİN] 12.'
----------------------------------------
ref: key='YARGITAY:12.HD:2009/30460-2009/27028:30.12.2009' url=AnyHttpUrl('https://karararama.yargitay.gov.tr/') etag=None last_modified=None metadata={'chamber': '12.HD', 'e_no': '2009/30460', 'k_no': '2009/27028', 'decision_date': '30.12.2009', 'doc_id': '70297300'}
doc_id=yargitay:12.HD:2009/30460-2009/27028:2009-12-30 title='Karar' chunks=1 checksum=9fe1e2fde9...
  chunk[0] tokens=109 preview='[KAYNAK:Yargıtay|DAİRE:12.HD|E:2009/30460|K:2009/27028|T:2009-12-30] [METİN] 12.'
----------------------------------------
ref: key='YARGITAY:12.HD:2009/30449-2009/27022:30.12.2009' url=AnyHttpUrl('https://karararama.yargitay.gov.tr/') etag=None last_modified=None metadata={'chamber': '12.HD', 'e_no': '2009/30449', 'k_no': '2009/27022', 'decision_date': '30.12.2009', 'doc_id': '70294300'}
doc_id=yargitay:12.HD:2009/30449-2009/27022:2009-12-30 title='Karar' chunks=1 checksum=99d218788c...
  chunk[0] tokens=76 preview='[KAYNAK:Yargıtay|DAİRE:12.HD|E:2009/30449|K:2009/27022|T:2009-12-30] [METİN] 12.'
----------------------------------------
ref: key='YARGITAY:12.HD:2009/30447-2009/27029:30.12.2009' url=AnyHttpUrl('https://karararama.yargitay.gov.tr/') etag=None last_modified=None metadata={'chamber': '12.HD', 'e_no': '2009/30447', 'k_no': '2009/27029', 'decision_date': '30.12.2009', 'doc_id': '70297700'}
doc_id=yargitay:12.HD:2009/30447-2009/27029:2009-12-30 title='Karar' chunks=1 checksum=40e7264b01...
  chunk[0] tokens=72 preview='[KAYNAK:Yargıtay|DAİRE:12.HD|E:2009/30447|K:2009/27029|T:2009-12-30] [METİN] 12.'
----------------------------------------
ref: key='YARGITAY:12.HD:2009/30382-2009/27021:30.12.2009' url=AnyHttpUrl('https://karararama.yargitay.gov.tr/') etag=None last_modified=None metadata={'chamber': '12.HD', 'e_no': '2009/30382', 'k_no': '2009/27021', 'decision_date': '30.12.2009', 'doc_id': '70293800'}
doc_id=yargitay:12.HD:2009/30382-2009/27021:2009-12-30 title='Karar' chunks=1 checksum=2deecc8718...
  chunk[0] tokens=76 preview='[KAYNAK:Yargıtay|DAİRE:12.HD|E:2009/30382|K:2009/27021|T:2009-12-30] [METİN] 12.'
----------------------------------------
2025-11-20 01:18:49 [warning  ] yargitay_detail_error          attempt=1 error=Page.wait_for_selector: Timeout 30000ms exceeded.
Call log:
  - waiting for locator("table tbody tr") to be visible
 key=YARGITAY:12.HD:2009/30367-2009/27020:30.12.2009
ref: key='YARGITAY:12.HD:2009/30367-2009/27020:30.12.2009' url=AnyHttpUrl('https://karararama.yargitay.gov.tr/') etag=None last_modified=None metadata={'chamber': '12.HD', 'e_no': '2009/30367', 'k_no': '2009/27020', 'decision_date': '30.12.2009', 'doc_id': '70293200'}
doc_id=yargitay:12.HD:2009/30367-2009/27020:2009-12-30 title='Karar' chunks=1 checksum=030d664603...
  chunk[0] tokens=103 preview='[KAYNAK:Yargıtay|DAİRE:12.HD|E:2009/30367|K:2009/27020|T:2009-12-30] [METİN] 12.'
----------------------------------------
ref: key='YARGITAY:12.HD:2009/30353-2009/27019:30.12.2009' url=AnyHttpUrl('https://karararama.yargitay.gov.tr/') etag=None last_modified=None metadata={'chamber': '12.HD', 'e_no': '2009/30353', 'k_no': '2009/27019', 'decision_date': '30.12.2009', 'doc_id': '70292600'}
doc_id=yargitay:12.HD:2009/30353-2009/27019:2009-12-30 title='Karar' chunks=1 checksum=05fcf6dfa0...
  chunk[0] tokens=76 preview='[KAYNAK:Yargıtay|DAİRE:12.HD|E:2009/30353|K:2009/27019|T:2009-12-30] [METİN] 12.'
----------------------------------------
ref: key='YARGITAY:12.HD:2009/30351-2009/27018:30.12.2009' url=AnyHttpUrl('https://karararama.yargitay.gov.tr/') etag=None last_modified=None metadata={'chamber': '12.HD', 'e_no': '2009/30351', 'k_no': '2009/27018', 'decision_date': '30.12.2009', 'doc_id': '70292200'}
doc_id=yargitay:12.HD:2009/30351-2009/27018:2009-12-30 title='Karar' chunks=1 checksum=6d3f0fd450...
  chunk[0] tokens=108 preview='[KAYNAK:Yargıtay|DAİRE:12.HD|E:2009/30351|K:2009/27018|T:2009-12-30] [METİN] 12.'
----------------------------------------
ref: key='YARGITAY:12.HD:2009/30302-2009/26957:30.12.2009' url=AnyHttpUrl('https://karararama.yargitay.gov.tr/') etag=None last_modified=None metadata={'chamber': '12.HD', 'e_no': '2009/30302', 'k_no': '2009/26957', 'decision_date': '30.12.2009', 'doc_id': '70221900'}
doc_id=yargitay:12.HD:2009/30302-2009/26957:2009-12-30 title='Karar' chunks=1 checksum=0b12c2e4fa...
  chunk[0] tokens=101 preview='[KAYNAK:Yargıtay|DAİRE:12.HD|E:2009/30302|K:2009/26957|T:2009-12-30] [METİN] 12.'
----------------------------------------
ref: key='YARGITAY:12.HD:2009/30296-2009/26958:30.12.2009' url=AnyHttpUrl('https://karararama.yargitay.gov.tr/') etag=None last_modified=None metadata={'chamber': '12.HD', 'e_no': '2009/30296', 'k_no': '2009/26958', 'decision_date': '30.12.2009', 'doc_id': '70222300'}
doc_id=yargitay:12.HD:2009/30296-2009/26958:2009-12-30 title='Karar' chunks=1 checksum=3d44cbfdb8...
  chunk[0] tokens=48 preview='[KAYNAK:Yargıtay|DAİRE:12.HD|E:2009/30296|K:2009/26958|T:2009-12-30] [METİN] 12.'
----------------------------------------
ref: key='YARGITAY:12.HD:2009/30291-2009/26959:30.12.2009' url=AnyHttpUrl('https://karararama.yargitay.gov.tr/') etag=None last_modified=None metadata={'chamber': '12.HD', 'e_no': '2009/30291', 'k_no': '2009/26959', 'decision_date': '30.12.2009', 'doc_id': '70238400'}
doc_id=yargitay:12.HD:2009/30291-2009/26959:2009-12-30 title='Karar' chunks=1 checksum=4c241ddaa4...
  chunk[0] tokens=72 preview='[KAYNAK:Yargıtay|DAİRE:12.HD|E:2009/30291|K:2009/26959|T:2009-12-30] [METİN] 12.'
----------------------------------------
ref: key='YARGITAY:12.HD:2009/30285-2009/26960:30.12.2009' url=AnyHttpUrl('https://karararama.yargitay.gov.tr/') etag=None last_modified=None metadata={'chamber': '12.HD', 'e_no': '2009/30285', 'k_no': '2009/26960', 'decision_date': '30.12.2009', 'doc_id': '70238800'}
doc_id=yargitay:12.HD:2009/30285-2009/26960:2009-12-30 title='Karar' chunks=1 checksum=843e0d0a30...
  chunk[0] tokens=71 preview='[KAYNAK:Yargıtay|DAİRE:12.HD|E:2009/30285|K:2009/26960|T:2009-12-30] [METİN] 12.'
----------------------------------------
ref: key='YARGITAY:12.HD:2009/30278-2009/26971:30.12.2009' url=AnyHttpUrl('https://karararama.yargitay.gov.tr/') etag=None last_modified=None metadata={'chamber': '12.HD', 'e_no': '2009/30278', 'k_no': '2009/26971', 'decision_date': '30.12.2009', 'doc_id': '70243200'}
doc_id=yargitay:12.HD:2009/30278-2009/26971:2009-12-30 title='Karar' chunks=1 checksum=faf46a7916...
  chunk[0] tokens=120 preview='[KAYNAK:Yargıtay|DAİRE:12.HD|E:2009/30278|K:2009/26971|T:2009-12-30] [METİN] 12.'
----------------------------------------
ref: key='YARGITAY:12.HD:2009/30277-2009/26972:30.12.2009' url=AnyHttpUrl('https://karararama.yargitay.gov.tr/') etag=None last_modified=None metadata={'chamber': '12.HD', 'e_no': '2009/30277', 'k_no': '2009/26972', 'decision_date': '30.12.2009', 'doc_id': '70243500'}
doc_id=yargitay:12.HD:2009/30277-2009/26972:2009-12-30 title='Karar' chunks=1 checksum=c972820703...
  chunk[0] tokens=49 preview='[KAYNAK:Yargıtay|DAİRE:12.HD|E:2009/30277|K:2009/26972|T:2009-12-30] [METİN] 12.'
----------------------------------------
ref: key='YARGITAY:12.HD:2009/30265-2009/26973:30.12.2009' url=AnyHttpUrl('https://karararama.yargitay.gov.tr/') etag=None last_modified=None metadata={'chamber': '12.HD', 'e_no': '2009/30265', 'k_no': '2009/26973', 'decision_date': '30.12.2009', 'doc_id': '70243900'}
doc_id=yargitay:12.HD:2009/30265-2009/26973:2009-12-30 title='Karar' chunks=1 checksum=d62fea129b...
  chunk[0] tokens=107 preview='[KAYNAK:Yargıtay|DAİRE:12.HD|E:2009/30265|K:2009/26973|T:2009-12-30] [METİN] 12.'
----------------------------------------
ref: key='YARGITAY:12.HD:2009/30260-2009/26974:30.12.2009' url=AnyHttpUrl('https://karararama.yargitay.gov.tr/') etag=None last_modified=None metadata={'chamber': '12.HD', 'e_no': '2009/30260', 'k_no': '2009/26974', 'decision_date': '30.12.2009', 'doc_id': '70244200'}
doc_id=yargitay:12.HD:2009/30260-2009/26974:2009-12-30 title='Karar' chunks=1 checksum=890e8ac5a0...
  chunk[0] tokens=103 preview='[KAYNAK:Yargıtay|DAİRE:12.HD|E:2009/30260|K:2009/26974|T:2009-12-30] [METİN] 12.'
----------------------------------------
ref: key='YARGITAY:12.HD:2009/30258-2009/26975:30.12.2009' url=AnyHttpUrl('https://karararama.yargitay.gov.tr/') etag=None last_modified=None metadata={'chamber': '12.HD', 'e_no': '2009/30258', 'k_no': '2009/26975', 'decision_date': '30.12.2009', 'doc_id': '70244700'}
doc_id=yargitay:12.HD:2009/30258-2009/26975:2009-12-30 title='Karar' chunks=1 checksum=b417c0756f...
  chunk[0] tokens=72 preview='[KAYNAK:Yargıtay|DAİRE:12.HD|E:2009/30258|K:2009/26975|T:2009-12-30] [METİN] 12.'
----------------------------------------
ref: key='YARGITAY:12.HD:2009/30250-2009/26970:30.12.2009' url=AnyHttpUrl('https://karararama.yargitay.gov.tr/') etag=None last_modified=None metadata={'chamber': '12.HD', 'e_no': '2009/30250', 'k_no': '2009/26970', 'decision_date': '30.12.2009', 'doc_id': '70242700'}
doc_id=yargitay:12.HD:2009/30250-2009/26970:2009-12-30 title='Karar' chunks=1 checksum=8e65a05e03...
  chunk[0] tokens=75 preview='[KAYNAK:Yargıtay|DAİRE:12.HD|E:2009/30250|K:2009/26970|T:2009-12-30] [METİN] 12.'
----------------------------------------
ref: key='YARGITAY:12.HD:2009/30241-2009/26964:30.12.2009' url=AnyHttpUrl('https://karararama.yargitay.gov.tr/') etag=None last_modified=None metadata={'chamber': '12.HD', 'e_no': '2009/30241', 'k_no': '2009/26964', 'decision_date': '30.12.2009', 'doc_id': '70240700'}
doc_id=yargitay:12.HD:2009/30241-2009/26964:2009-12-30 title='Karar' chunks=1 checksum=0b3ed9ceeb...
  chunk[0] tokens=106 preview='[KAYNAK:Yargıtay|DAİRE:12.HD|E:2009/30241|K:2009/26964|T:2009-12-30] [METİN] 12.'
----------------------------------------
ref: key='YARGITAY:12.HD:2009/30239-2009/26965:30.12.2009' url=AnyHttpUrl('https://karararama.yargitay.gov.tr/') etag=None last_modified=None metadata={'chamber': '12.HD', 'e_no': '2009/30239', 'k_no': '2009/26965', 'decision_date': '30.12.2009', 'doc_id': '70241100'}
doc_id=yargitay:12.HD:2009/30239-2009/26965:2009-12-30 title='Karar' chunks=1 checksum=7391e936a1...
  chunk[0] tokens=49 preview='[KAYNAK:Yargıtay|DAİRE:12.HD|E:2009/30239|K:2009/26965|T:2009-12-30] [METİN] 12.'
----------------------------------------
ref: key='YARGITAY:12.HD:2009/30196-2009/26966:30.12.2009' url=AnyHttpUrl('https://karararama.yargitay.gov.tr/') etag=None last_modified=None metadata={'chamber': '12.HD', 'e_no': '2009/30196', 'k_no': '2009/26966', 'decision_date': '30.12.2009', 'doc_id': '70241500'}
doc_id=yargitay:12.HD:2009/30196-2009/26966:2009-12-30 title='Karar' chunks=1 checksum=900c1a2465...
  chunk[0] tokens=108 preview='[KAYNAK:Yargıtay|DAİRE:12.HD|E:2009/30196|K:2009/26966|T:2009-12-30] [METİN] 12.'
----------------------------------------
ref: key='YARGITAY:12.HD:2009/30097-2009/26969:30.12.2009' url=AnyHttpUrl('https://karararama.yargitay.gov.tr/') etag=None last_modified=None metadata={'chamber': '12.HD', 'e_no': '2009/30097', 'k_no': '2009/26969', 'decision_date': '30.12.2009', 'doc_id': '70242300'}
doc_id=yargitay:12.HD:2009/30097-2009/26969:2009-12-30 title='Karar' chunks=1 checksum=dfd4d5cfe1...
  chunk[0] tokens=76 preview='[KAYNAK:Yargıtay|DAİRE:12.HD|E:2009/30097|K:2009/26969|T:2009-12-30] [METİN] 12.'
----------------------------------------
ref: key='YARGITAY:12.HD:2009/30093-2009/26977:30.12.2009' url=AnyHttpUrl('https://karararama.yargitay.gov.tr/') etag=None last_modified=None metadata={'chamber': '12.HD', 'e_no': '2009/30093', 'k_no': '2009/26977', 'decision_date': '30.12.2009', 'doc_id': '70261500'}
doc_id=yargitay:12.HD:2009/30093-2009/26977:2009-12-30 title='Karar' chunks=1 checksum=d9fe027ca7...
  chunk[0] tokens=102 preview='[KAYNAK:Yargıtay|DAİRE:12.HD|E:2009/30093|K:2009/26977|T:2009-12-30] [METİN] 12.'
----------------------------------------
ref: key='YARGITAY:12.HD:2009/30071-2009/26961:30.12.2009' url=AnyHttpUrl('https://karararama.yargitay.gov.tr/') etag=None last_modified=None metadata={'chamber': '12.HD', 'e_no': '2009/30071', 'k_no': '2009/26961', 'decision_date': '30.12.2009', 'doc_id': '70239200'}
doc_id=yargitay:12.HD:2009/30071-2009/26961:2009-12-30 title='Karar' chunks=1 checksum=f82b38fc62...
  chunk[0] tokens=72 preview='[KAYNAK:Yargıtay|DAİRE:12.HD|E:2009/30071|K:2009/26961|T:2009-12-30] [METİN] 12.'
----------------------------------------
ref: key='YARGITAY:12.HD:2009/30028-2009/26962:30.12.2009' url=AnyHttpUrl('https://karararama.yargitay.gov.tr/') etag=None last_modified=None metadata={'chamber': '12.HD', 'e_no': '2009/30028', 'k_no': '2009/26962', 'decision_date': '30.12.2009', 'doc_id': '70239800'}
